"- Facebook chief Mark Zuckerberg on Thursday announced the parent company's name is being changed to ""Meta"" to represent a future beyond just its troubled social network.",1
"The new handle comes as the social media giant tries to fend off one its worst crises yet and pivot to its ambitions for the ""metaverse"" virtual reality version of the internet that the tech giant sees as the future.",1
"Mark Bayer, president of Bayer Strategic Consulting, noted that, “A name change now—when Facebook is under intense scrutiny—reinforces the perception the company is trying to elude responsibility for its lengthening list of misdeeds.",1
"Even if disconnected from the current crisis, the name change will be seen as a clumsy PR move.",0
"“Over time, I hope that we are seen as a metaverse company.",1
“This is interesting because it is an apt example of an often-used marketing tactic to divert attention away from negative publicity by rebranding or introducing a new identity for the company.,1
“We’ve seen other companies like Google do this with the creation of Alphabet.,1
"It will be up to “Meta” and Mark Zuckerberg to prove that this switch wasn’t an obvious crisis communication strategy to divert from the crises plaguing Facebook, and that it backs up its rebranding explanations for the switch with real value for consumers and shareholders,” he concluded.",1
"Facebook will still be Facebook and each week will uncover yet another scandalous thing Zuckerberg & Co. have tried to cover up,” he said.",0
"While there is a long-standing Jewish tradition to rename a person going through life-threatening medical challenges, I don't think Zuckerberg had that in mind.",0
"Name change aside, the company has a lot of work to do to rebuild trust and confidence in consumers and demonstrate that it can really protect privacy while maintaining balanced and fair standards that are applied to everyone, not just select individuals.",1
"Agency, said “Facebook's decision to change the platform's name is a classic redirection to pull attention away from not only what the public perceives, but what every marketing professional knows.",1
It can’t hide or erase the past with a face lift.,0
"“Meta"" actually fits as a name, as it appears they are moving towards a data driven platform and not connecting people.",1
Facebook’s decision to rebrand is an ill-timed move but not for the reason you might think.,1
The author argues that the real problem is that Facebook is re-branding before its vision is a reality.,1
"Right now, social media remains the core of the company’s operations and revenues.",0
"By adopting a brand name that is based on future potential capabilities and a platform and products that, by Zuckerberg’s own admission, may not be offered for a decade, the company sets itself up to confuse people at best; at worst, it will disappoint people and further degrade their trust in the company.",1
Last week Facebook CEO Mark Zuckerberg announced his company is changing its name to Meta.,1
"The rebrand has been panned for many reasons: it’s a foolish attempt to distract from the criticism the company has recently faced; the metaverse that the new name refers to is not well-known or understood, so it’s confusing; Meta is a stupid company name, etc.",1
"Right now, social media remains the core of the company’s operations and revenues.",0
"By adopting a brand name that is based on future potential capabilities and a platform and products that, by Zuckerberg’s own admission, may not be established for nearly a decade, the company sets itself up to confuse people at best; at worst, it will disappoint people and further degrade their trust in the company.",1
It’s not surprising that Facebook would take this tact; many companies do.,1
"When business leaders want to change their company’s identity or reposition their business, they often turn to external messaging and communications first — a new name, a fresh logo, an advertising campaign.",1
There might have been a time in the past when a corporate makeover was effective at changing public opinion.,1
"By adopting a new name, Facebook may be trying to claim that it is developing innovative technologies that bring people together in new and exciting ways.",1
"It should have waited until it addressed these problems, and more importantly, established itself as a provider of metaverse products or applications before announcing a new brand.",1
That’s what Google did when its corporate entity was rebranded to Alphabet in 2015.,1
"Over many years leading up the change, Google’s business had expanded well beyond its search engine product.",1
"When the company adopted its new name, it had already become a tech conglomerate comprised of a wide range of companies and products including driverless cars, medical devices, and smart home appliances.",1
"As a result, the brand change not only made sense, but it also effectively minimized the associations between Google and its sister companies, shielding Google from concerns from the public raised about emerging technologies (“creepy” drones, dangerous autonomous vehicles, etc.)",1
and shielding the other entities from the profit expectations of Wall Street placed on Google.,1
"Despite its new name, Facebook cannot effectively create any separation between its social media business and the metaverse and other developments because the latter are only in their infancy.",1
"Of course, not all companies rely on name changes to repair their public images.",0
Consider Microsoft’s transformation.,1
"When CEO Satya Nadella set out to remake the company and address its critics, the company embraced AI, mobile, and cloud-first strategies; opened itself up to partnerships (e.g., Linux); aggressively pursued acquisitions (e.g., LinkedIn); and implemented digital transformation across its operations.",1
"And yet, Microsoft hasn’t felt the need to change its name or launch any kind of corporate campaign to promote the changes.",1
"Instead, it has relied on its operational and culture changes to resurrect its business and shift public opinion.",1
"With its rebranding effort, Facebook is making promises that it doesn’t seem able to deliver right now.",1
"The company was a manufacturer of potentially addictive opiate painkillers, a business it discontinued entirely in the United States last year.",1
"Johnson & Johnson, like other medical companies, has weathered its share of reputation-threatening controversies.",0
The company regained public trust by quickly pulling Tylenol from American shelves and introducing new tamper-resistant packaging.,1
"Throughout, the company has relied on the “halo effect” created by popular consumer products, none more so than its Johnson’s Baby line of shampoos, lotions, moisturizers and powder for infants.",0
"“It gives us a wonderful image that most companies would kill for,” Ralph S. Larsen, the company’s chairman at the time, told Forbes in 2001.",0
"Even lingering affection for the company’s consumer products does not do much to advance Johnson & Johnson’s medical businesses, which are far more important to the company’s finances.",1
"BlackRock is overhauling its investing strategy to make sustainability the ""new standard for investing,"" which will include launching new active and passively-managed funds that focus on socially responsible investing.",1
"Since the company offers exchange-traded funds that track the S&P 500, for example, it's difficult to unilaterally sell stocks of companies that engage in activities that might not align with a customer's values.",0
"In 2018 he said that companies must focus on more than just making money, and in 2019 he argued that companies need to take positions on societal issues.",1
"This time around, his letter feels more immediate, since the company also announced a host of new initiatives, including doubling its exchange traded funds, or ETF's, that focus on companies' environmental, social and governance factors, or ESG.",1
The firm is also moving away from thermal coal companies.,1
"""Because sustainable investment options have the potential to offer clients better outcomes, we are making sustainability integral to the way BlackRock manages risk, constructs portfolios, designs products, and engages with companies,"" the firm's global executive committee, which includes Fink, wrote in its letter to clients Tuesday.",1
"Instead of optimizing for market cap-weighted exposure, these funds will instead focus on ESG-optimized exposure.",1
"The company also plans to expand its offerings of sustainability-focused passive funds, as well as its impact investing arm.",1
"""As the largest investment firm in the world, it was very clear to me that more and more clients are looking for advice from us,"" Fink said.",0
"""Probably the most important inference from my observations is I believe we are just beginning a major reallocation of capital.""",1
"As ESG-focused investing has grown in popularity so, too, have critics of the style, who argue that the inherently subjective nature means there's little accountability.",0
"The company said it's divesting from companies that generate more than 25% of their revenue from thermal coal production — or coal used for power production — from its actively managed portfolio, which it hopes to complete by the middle of 2020.",1
"This extends to the firm's alternative business, which BlackRock said will make no future direct investments in companies focused on thermal coal production.",1
"This includes sustainable versions of the firm's flagship index products, and there will also be options to screen out specific sectors entirely.",0
"Unilever simplifies organisation London, 25 January 2022.",1
"Unilever today announced changes to its organisational model to make it a simpler, more category-focused business.",1
"The company will move away from its current matrix structure and will be organised around five distinct Business Groups: Beauty & Wellbeing, Personal Care, Home Care, Nutrition, and Ice Cream.",1
"Each Business Group will be fully responsible and accountable for their strategy, growth, and profit delivery globally.",1
"Alan Jope, CEO Unilever, explains, “Our new organisational model has been developed over the last year and is designed to continue the step-up we are seeing in the performance of our business.",1
"Moving to five category-focused Business Groups will enable us to be more responsive to consumer and channel trends, with crystal-clear accountability for delivery.",1
A lean Unilever Corporate Centre will continue to set Unilever’s overall strategy.,1
"As a result of the new set-up, Unilever is making changes to its leadership team.",1
"Fernando Fernandez, EVP Latin America, has been appointed President Beauty & Wellbeing, which includes Hair Care, Skin Care, as well as Vitamins, Minerals and Supplements, and Unilever Prestige.",1
"Fabian Garcia, President North America, has been appointed President Personal Care, responsible for Skin Cleansing, Deodorants, and Oral Care.",1
"Peter ter Kulve will continue in his role as President Home Care, responsible for Fabric Care, Home & Hygiene, and Water & Air.",0
"Hanneke Faber, President Foods & Refreshment, has been appointed President Nutrition, which will be home to Scratch Cooking, Healthy Snacking, Functional Nutrition, Plant-Based Meat, and Food Solutions.",1
"Matt Close, EVP Ice Cream, has been appointed President Ice Cream, a Business Group in its own right.",1
"Reginaldo Ecclissato, Chief Supply Chain Officer, will lead the Supply Chain and Unilever Business Operations as Chief Business Operations Officer.",1
"Sunny Jain, President Beauty & Personal Care, has decided to leave Unilever to set up an investment fund in technology megatrends.",1
We do not expect factory teams to be impacted by these changes.,0
"MALVERN, Pa., Feb. 15, 2022 (GLOBE NEWSWIRE) -- Vishay Precision Group, Inc. (NYSE: VPG), a leader in precision measurement sensing technologies, today announced a new corporate strategy resulting in a realignment of its reporting business segments.",1
The new corporate strategy and reporting structure builds on the Company’s strengths and investments.,1
"The change is designed to accelerate the Company’s growth and optimize its financial performance by leveraging its core technologies, competitive position, and deep technical expertise in growing applications that increasingly require precision measurement solutions.",1
"Marc Zandman, Chairman of the Board of VPG, commented: “We are excited to announce this next evolutionary step for VPG and the potential for faster growth and long-term value creation it provides.",1
"This reflects an evolution from the Company's previous strategy of vertical product/technology integration, in which the Company sought to source and integrate components, products and technologies from one business to another.",1
"Ziv Shoshani, Chief Executive Officer of VPG, commented, ""We believe the timing is optimal for this change given broadening precision sensing applications in both our traditional industrial markets and new areas, due to the development of higher functionality in our customers' end products.",1
"With this change, we are now better positioned to address a number of positive trends in semiconductor test equipment, electrification, consumer applications, increased safety testing, and regulatory requirements, among others.",1
"""Our three reporting segments, which place an expanded emphasis on precision measurement sensing technologies, are each centered on its own capabilities, strategic and operational synergies, and competitive positions to drive additional customer value,"" Mr. Shoshani said.",1
"The Weighing Solutions segment is comprised of the force sensors, on-board weighing, and process weighing business lines.",0
"To access the conference call, interested parties may call 1-888-317-6003 or internationally 1-412-317-6061 and use passcode 5963923, or on the ""Events"" page of the investor relations section of the VPG website at ir.vpgsensors.com.",0
"The replay will also be available for a limited time on the ""Events"" page of the investor relations section of the VPG website at ir.vpgsensors.com.",0
"Such statements (including those regarding our new corporate strategy), are based on current expectations only, and are subject to certain risks, uncertainties, and assumptions.",1
"NEW YORK , Feb. 8, 2022 /PRNewswire/ -- Peloton Interactive, Inc. (NASDAQ: PTON) today announced a series of steps it is taking to position the business for long-term growth while establishing a clear path to consistent profitability and sustainable free cash flow.",1
The company will also reduce its planned capital expenditures in 2022 by approximately $150 million .,1
"""Peloton is at an important juncture, and we are taking decisive steps.",1
"Our focus is on building on the already amazing Peloton Member experience, while optimizing our organization to deliver profitable growth,"" said John Foley , Co-Founder of Peloton and newly appointed Executive Chair.",1
"""With today's announcements, we are taking action to ensure Peloton capitalizes on the large, long-term Connected Fitness opportunity.",1
"This restructuring program is the result of diligent planning to address key areas of the business and realign our operations so that we can execute against our growth opportunity with efficiency and discipline.""",1
The company is winding down the development of its Peloton Output Park (POP) manufacturing plan.,1
"In addition, Peloton will optimize its logistics network by reducing its owned and operated warehousing and delivery footprint, while scaling third party relationships.",1
The company is winding down the development of its (POP) manufacturing plan.,1
"In addition, Peloton will optimize its logistics network by reducing its owned and operated warehousing and delivery footprint, while scaling third party relationships.",1
Right-size the organization by enacting a workforce reduction.,1
The workforce reduction will occur across nearly all business operations to streamline reporting structures and create clearer lines of accountability.,1
"With regard to operations in the field, the company is reducing its owned and operated warehouses and delivery teams and expanding its commercial agreements with third party logistics providers.",1
The Conference ID is 1271026.,0
"The company pioneered connected, technology-enabled fitness, and the streaming of immersive, instructor-led boutique classes for its Members anytime, anywhere.",1
Ericsson’s (NASDAQ: ERIC) strategy is to be a leader in mobile infrastructure and to establish an enterprise business.,1
"Today, Ericsson announces changes to the group structure and Executive Team to position itself to execute on its strategy and growth ambitions while continuing to invest in R&D to maintain its technology leadership.",1
"This will enable Ericsson to capitalize on the convergence of cloud, software and services.",1
"Through the new structure, Ericsson will be able to leverage investments in R&D, increase cloud native expertise and build its combined offerings for automation and AI for service delivery.",1
"Jan Karlsson, currently head of Business Area Digital Services, will leave the Executive Team and instead drive the development of the Global Network Platform, reporting to CEO Börje Ekholm.",1
"As previously communicated, Peter Laurin, currently head of Business Area Managed Services will leave Ericsson for opportunities outside Ericsson.",1
“Through the new Business Area Cloud Software and Services we provide solutions that will help our customers automate the increasingly complex networks for cost advantages and speed to market.,1
I look forward to working with Per as we take the next steps in reaching Ericsson’s growth ambitions.,1
I also want to thank Jan and Peter for their contributions to the Executive Team.,0
"They have both been instrumental in executing on our focused strategy and Ericsson’s turnaround”, says Börje Ekholm.",1
The new Business Area will enable Ericsson to build on recent success which includes strong growth for Cradlepoint as 5G coverage increases on the US C-band and the launch of Ericsson Private 5G (EP5G) in several leading markets.,1
“With this change we are taking important steps in our journey to execute on our strategy.,1
The new Business Area Enterprise Wireless Solutions will provide the focus and conditions we need to thrive in the enterprise market and secure the next wave of success for this business.,1
"By creating a global operations function, Ericsson will be able to run its global operations more effectively and consistently across the organization.",1
“Global Operations is created to achieve best-in class customer and employee experience by simplifying and digitalizing end-to-end process flows in the company.,1
"By creating this function, we will be able to better serve the needs of our customers and better support our people, making us more agile and more competitive.",1
The Acting Head of Market Area Europe and Latin America will be announced separately.,1
"“Arun has been leading our Market Area Europe and Latin America for the last five years and has been instrumental in driving change across the organization, and in establishing and nurturing some of our most important customer relationships.",1
"“After turning around the company, Ericsson is entering a new phase of growth.",1
"The changed group structure that we announce today represents exciting opportunities for our people, our customers and our business and will allow us to continue to grow our core mobile infrastructure business and capitalize on the fast-growing enterprise market.",1
"Within 2-3 years, we want to achieve our long-term goal of growing faster than the market and an EBITA margin (excluding restructuring costs) of 15-18% for the Group.",1
"I look forward to working together with the new Executive Team, and the whole Ericsson team, as we accelerate our work to execute on our strategy, strengthen our company culture and continue to grow the company with increased profitability”, concludes Ekholm.",1
"On completion of the acquisition, Vonage will form a separate Business Area included in this segment.",1
"The company’s portfolio spans Networks, Digital Services, Managed Services, and Emerging Business and is designed to help our customers go digital, increase efficiency and find new revenue streams.",1
Ericsson’s investments in innovation have delivered the benefits of telephony and mobile broadband to billions of people around the world.,0
"Important factors that could affect whether and to what extent any of our forward-looking statements materialize include, but are not limited to, the factors described in the section “Risk Factors” in the latest interim report, and in “Risk Factors” in the Annual Report 2021.",0
CHICAGO – When Miguel Patricio took over as chief executive officer of the Kraft Heinz Co. he sought to turn the company around by realigning its product portfolio and using its scale to improve results.,1
"Now Kraft Heinz is entering phase three of his strategy and plans to embed agility into the organization with digital technologies that will improve customer service, innovation and marketing initiatives.",1
"“The first two phases of our transformation were designed to bring scale and agility together,” Mr. Patricio said Feb. 22 during a presentation at the virtual Consumer Analyst Group of New York conference.",1
"“We focused on capabilities, processes and disciplines that, in many ways, were new to Kraft Heinz, but not necessarily new to the world.",1
"“In other words, we are building a more powerful engine to supercharge our operating model,” Mr. Patricio said.",1
Agile@Scale is how we will go about opening new growth opportunities and unlocking greater efficiencies.,1
"Just Spices is a manufacturer of spices, spice blends, salad dressings and meal kits, and approximately 70% of the company’s sales are direct-to-consumer.",1
"“Just Spices brings a proven AI (artificial intelligence) solution and differentiated approach to spices with a focus on recipes and (that targets) younger consumers through a fully integrated direct-to-consumer marketplace,” Mr. Abrams-Rivera said.",1
"“We are creating a much deeper and granular level of understanding of our consumers, who they are, their needs and their behaviors,” Mr. Abrams-Rivera said.",1
Mr. Abrams-Rivera said that one year ago Kraft Heinz was managing between 60% and 70% variability in its shipments.,1
"“As a solution, we created a Kraft Heinz proprietary ecosystem to design the perfect shipment.",1
"The first step was to ingest approximately 50 data sources, aggregating internal data, like historical inventory turnover, trade promotions and sales activity, alongside external data, such macroeconomic factors like weather to create demand planning view all the way down to the store and SKU (stock-keeping unit) level.",1
"Change is never easy, and when you’re a 112-year-old enterprise like Walgreen Company (“Walgreens”), it’s even less so.",1
That was our business strategy.,0
"We called it “seven by 10,” meaning we wanted to have 7,000 stores by 2010.",1
"In fact, we beat that goal—going from 4,250 stores in 2003 to 7,000 in 2009.",1
"To support the seven-by-10 strategy, we had some well-refined capabilities.",1
"For example, we were very good at managing real estate, including construction and analytics.",0
The old Walgreens business strategy required a command-and-control approach to leadership.,1
But then the competitive landscape changed.,1
"New rivals entered the market, such as third-party pharmacy benefits management companies that deliver prescriptions by mail.",1
More grocers started offering in-store pharmacies.,1
"An even bigger challenge was the growth of Internet pure plays, like Amazon and Google, which sell most of what we carry.",1
All of these had the potential to lure customers out of our stores.,1
"At the same time, we started to see significant changes in healthcare, which ultimately resulted in the passage of the Affordable Care Act and the advent of accountable care organizations.",0
"Throw in the worst economy since the Great Depression, and we knew we had to change our strategy.",1
"In this new market, with the huge push to improve quality and reduce overall healthcare costs, Walgreens had a significant opportunity to become a player in the healthcare value chain.",1
"As a result, we evolved from simply filling prescriptions for people to becoming a single point of patient care, and a destination for health and daily-living products and services for our customers.",1
"To succeed in this new role, we had to change our business strategy.",1
"Instead of relying on a real estate play—location, location, location—we focused on improving the customer experience.",1
"As our strategy evolved and our focus changed from opening stores to delivering an exceptional customer experience, we recognized that not only was the command-and-control approach outdated, but it also prevented us from getting the best from our people.",1
It’s strange—people have an emotional connection to a cup of coffee.,0
This represented a fundamental change in how we engaged with our market.,1
We wanted to be more than a simple retail chain—we wanted to be an experience provider.,1
"To execute that strategy, however, we needed to redesign some components of the organization.",1
We had to focus our frontline and field leadership on coaching employees and creating the right customer interactions.,1
