"- Facebook chief Mark Zuckerberg on Thursday announced the parent company's name is being changed to ""Meta"" to represent a future beyond just its troubled social network.",1
"We’d clearly need to redefine roles, but we also knew that some of our incentives weren’t aligned with the new behaviors we wanted among the field employees.",1
"Next came incentives; we had to change the way that we motivated and rewarded people, to emphasize employee engagement and customer satisfaction.",1
"Given that each district manager oversees almost 1,000 people, managing, developing, and operating the business can be a challenge.",0
"We had recognized years before that although Walgreens had centralized processes for functions including HR, IT, employee relations, and finance, we couldn’t make all those decisions at the corporate level.",1
"First, for each of our 30 U.S. markets, we created a position called vice president for markets, located in the field (the local geography).",1
We did this to move corporate-level leadership closer to the customer.,1
"To support them, and to bring market-level resources closer to the customer’s experience, we also moved functions such as HR, IT, real estate, employee relations, and finance to the field.",1
"Along with these departments, we gave every market its own profit and loss responsibility.",1
This really drove accountability at the local level.,0
We had tried to improve customer service in the past.,0
So we moved some decisions that had been located within the field management structure higher up.,1
"With this adjustment, managers have more time to work on the company’s new priorities—employee engagement and improving the customer experience.",1
"Another goal was to develop management skills at the store level, so those people could make solid decisions that were right for their community.",0
"Some are swamped in the morning, for example, and some don’t have their first customer until 11 o’clock.",0
"Now, the way we do things is different.",1
"At the store level, we don’t want employees to simply complete tasks.",1
We based our bonus and advancement system purely on financial performance—meaning how sales and profit numbers matched expectations.,0
"With this shift, we set up a true pay-for-performance system, including incentives to drive the behaviors we wanted.",1
Leadership at Walgreens today carries a different expectation and is rewarded accordingly.,1
There’s also a percentage that accounts for community engagement and events.,0
There’s another component to accountability: managing underperformers.,0
We hadn’t had those policies in place before.,1
"We’re clear about the new expectations regarding the treatment of customers, and we’re training employees to meet those standards.",1
"For instance, we instituted five-minute meetings every day, in every store.",1
"If we provide the right training and leadership, the store managers and employees will come up with the answers they need on their own—the right solution for their location and market.",1
"We also implemented “store walks,” in which market vice presidents and district managers visit stores in their markets and determine what’s working well and what’s not.",1
"One of the questions in our employee engagement survey is “Do you have a best friend at work?” We want that kind of social connection, because it’s a big part of how our employees grow and remain engaged, which translates to a better experience for our customers, and for them.",0
But they worked so well in the pilot that we rolled them out to the entire company.,1
"We think next year will be even better—everyone now understands the larger strategy, we have targets in place, and company bonuses will be awarded against those targets.",1
"For example, we used to expect our store clerks to be efficient.",0
Now we encourage them to cultivate the kind of friendliness that will attract customers.,1
She knows many customers by name.,0
“Where’s Francelle?,0
"Investors are increasingly interested in companies that are environmentally and socially conscious, and the world's largest asset manager is no exception.",0
"Now, the firm has updated its global principles and guidelines to reflect its commitment to climate and diversity.",1
"In the midst of the Covid-19 pandemic, ""investors and others will be looking to see how companies are rebuilding their businesses for long-term sustainability and value creation,"" BlackRock said in its 2021 stewardship expectations.",1
"Among the changes being implemented in 2021, BlackRock said it expects companies to disclose a plan for transitioning to a lower carbon economy, report key stakeholders and business interests, and improve racial and gender diversity on large corporate boards.",1
"In 2020, BlackRock held a substantial stake in approximately 91% of S&P 500 companies and across these companies that position averaged 7.7%, according to data compiled by Jackie Cook, director of sustainable stewardship research at Morningstar, based on annual proxy reports.",0
"Peloton's new chief executive, Barry McCarthy, has only been at the helm of the connected fitness company for about a month.",1
But he's already testing ways to lure new customers and make the business more profitable.,1
"Peloton confirmed to CNBC that on Friday it will start to trial a new pricing system, where customers pay a single monthly fee for both their workout equipment and for access to Peloton's on-demand fitness classes.",1
"Should a user choose to cancel, Peloton would take back the Bike.",1
"Customers will only be able to choose this option through Peloton's brick-and-mortar stores, or its fitness studios, and not online.",1
"Peloton also announced Thursday that it has hired Andrew Rendich, former chief operating officer of the e-commerce company Grove Collaborative, as its chief supply chain officer, effective next week.",1
The company is trying to win over skeptical investors.,1
At least one Wall Street analyst has already questioned whether the new pricing plan could end up weighing on Peloton's brand and finances.,1
Peloton spokeswoman Amelise Lane said Peloton created the limited-time pilot in select markets in the United States to explore various pricing models and options for new members.,1
"""This aligns with Peloton's belief that intuition drives testing and data drives decision making as the company sets course for the next phase of its evolution and growth,"" Lane said in an emailed statement.",1
The bigger upfront expense comes with the company's equipment.,0
"Peloton's original Bike currently costs $1,745, including delivery and setup fees, while its Bike+ retails for $2,495.",1
"The company last August had cut the price of its Bike by about 20% to $1,495, not including delivery, hoping to appeal to more consumers with a cheaper option.",1
"McCarthy has already made it very clear, too, that prices could fall further as he aims to grow Peloton's user base beyond the Covid pandemic.",1
"The former Netflix and Spotify exec, who took over the CEO role from Peloton co-founder John Foley, has been tasked with getting Peloton back to profitability, as the company grapples with waning demand for at-home workout products and heightened supply chain expenses.",1
"""I think there's enormous opportunity for us to flex the business model and dramatically increase the [total addressable market] for new members by lowering the cost of entry and playing around with the relationship between the monthly recurring revenue and the upfront revenue,"" McCarthy said in an interview with CNBC's Jim Cramer last month.",1
"While the bundled pricing strategy is only a test, and it's unclear if and when Peloton would incorporate this idea permanently, BMO Capital Markets analyst Simeon Siegel raised questions about the damage it could do to Peloton's financials and to its brand image.",1
"""For a company that has been plagued with logistic issues, they are now effectively allowing people to return their piece of equipment, at a moment's notice,"" Siegel said.",1
"""They're actually throwing themselves more into the delivery and logistics game.",1
Peloton's average net monthly connected fitness churn was 0.79% in the latest period.,0
"""Does Peloton become a winter experience for customers who every year rent the bike for four months, and then give it back when the weather's nice?",1
"One user also asked in a Reddit thread about the pricing test if Peloton would, as a result, change the membership fee for people who already own the company's equipment.",1
"As of Dec. 31, Peloton counted 2.77 million connected fitness subscribers.",0
"In another bid to win customers, Peloton recently extended its free at-home trial for its Bike, Bike+ and Tread machines to 100 days from 30.",1
"The company also has new cardio products on the way, including a strength training device called Peloton Guide and a rowing machine.",1
"By manufacturing a suite of connected fitness options, Peloton aims to be a tougher competitor to rivals such as Hydrow, Tonal and Lululemon's Mirror.",1
"Its hope is that people who already own a Bike or a Tread will buy more stuff within the Peloton ecosystem, including its own apparel.",1
"When McCarthy took over as CEO, he wrote in a memo to employees that Peloton had to find ways to drive growth.",1
"While the company has consistently churned out big hits, such as ""Stranger Things"" and ""Squid Game,"" Netflix is rethinking many of the philosophies that disrupted the industry more than a decade ago.",1
"The change in strategy, even on the margins, is a surprising one for a company best known for disrupting two industries — first video rental and then cable TV.",1
"Instead of inventing new ways to upend what's become a crowded streaming video industry, Netflix is reconsidering nearly all of the ways it stood out from legacy media companies in the first place.",1
"In other words, Hastings has decided his best strategy now is to un-disrupt.",1
"""It's notable that Netflix is seeking growth by rethinking many of its firmly held beliefs,"" said Joel Mier, Netflix's director of marketing from 1999 to 2006 and a lecturer in marketing at the University of Richmond.",1
"""These decisions will clearly help revenue and subscriber growth in the short- to mid-term.",1
"""Then you realize you have to rip that revenue away from other places because the total ad market isn't growing, and in fact right now it's shrinking.",1
"It's hand-to-hand combat to get people to spend less on, you know, ABC and to spend more on Netflix.",1
"So I would say our subscription-focused strategy's worked pretty well.""",1
Netflix is no longer more than $500 a share.,1
"Since making that comment in 2020, Hastings has watched other streaming services, including Warner Bros.",1
"Discovery's HBO Max, NBCUniversal's Peacock and Paramount Global's Paramount+, launch lower-priced services with ads without a consumer backlash.",1
Disney plans to unveil a cheaper ad-supported Disney+ later this year.,1
"An ad-supported Netflix ""makes a lot of sense"" for ""consumers who would like to have a lower price and are advertising tolerant,"" he said.",1
Netflix has previously argued it found a gap in the market by not worrying about advertising.,1
"Niche shows, which wouldn't play well with advertisers, who want scale, could be valuable for Netflix if they brought in enough subscribers relative to production budgets.",1
It remains to be seen whether Netflix will offer its full slate of content on an ad-supported service or if certain shows will be walled off for no-ad subscribers only.,1
Other streamers have followed suit after seeing Netflix attract A-list talent by skipping pilots.,1
"Show creators would ask us, 'Do you want to see notes?",0
"Creators were gobsmacked.""",0
"Ordering projects straight to series gave writers and producers certainty and, frequently, more money.",1
Deadline noted 47 different examples of Netflix ordering straight to series in 2020-21 and 20 for 2022.,0
"Netflix plans to start ordering more pilots and slow down on its straight-to-series development process, according to people familiar with the matter.",1
The hope is the end result will lead to higher-quality programming and less fluff.,0
Netflix doesn't plan to lower its overall budget on content.,1
"Still, it does intend to reallocate money to focus on quality after years of adding quantity to fill its library, the people said.",1
Executives have added more original programming in recent years to avoid a lasting reliance on licensed content — much of which has been pulled back by the media companies who own it to fill their own streaming services.,1
"""The move away from appointment television is enormous.",1
"Read more: Netflix's binge-release model is under new scrutiny ""We fundamentally believe that we want to give our members the choice in how they view,"" Peter Friedlander, Netflix's head of scripted series for U.S. and Canada, said earlier this month.",1
"""And so giving them that option on these scripted series to watch as much as they want to watch when they watch it, is still fundamental to what we want to provide.""",0
"But people familiar with the matter said Netflix will continue to play around with weekly releases for certain types of series, such as reality TV and other shows based on competition.",1
Netflix's resistance to weekly scripted release may be the next thing to go.,1
"""We have so much we want to do in our area, so we're not trying to copy others, whether that's linear cable, there's lots of things we don't do.",1
"Yet, last year, Hastings said Netflix will consider bidding on live Formula One rights to pair with the success of its documentary series ""Drive to Survive,"" which profiles each racing season.",1
"""At that time we were not among the bidders, today we would think about it.""",1
"This month, Business Insider reported Netflix has been holding talks with Formula One for months for U.S. broadcast rights.",1
"Adding live sports may give Netflix a new audience base, but it flies in the face of Netflix's recent aversion to spending big money on licensed programming.",1
"In 2017, Netflix's corporate account tweeted ""Love is sharing a password.""",1
"But as Netflix's growth has slowed, executives see password-sharing crackdowns as a new engine to reinvigorate revenue growth.",1
"""We're working on how to monetize sharing.",1
"Over the next year, Netflix plans to charge accounts that are clearly shared with users outside the home additional fees.",1
"""We're not trying to shut down that sharing, but we're going to ask you to pay a bit more to be able to share with her and so that she gets the benefit and the value of the service, but we also get the revenue associated with that viewing,"" Chief Operating Officer Greg Peters said during the same call, adding it will ""allow us to bring in revenue for everyone who's viewing and who gets value from the entertainment that we're offering.""",1
CNBC reported earlier on how the password-sharing crackdown is likely to work.,1
Netflix has benefited from being a pure-play streaming company for years.,0
"While other media companies, such as Disney, have lagged because of a conglomerate discount and slow-growing or declining legacy assets, investors have loved Netflix's one-trick pony: streaming growth.",1
Netflix announced last year it's dabbling in video games.,1
Netflix currently has 22 video games on its platform and aims to have 50 by year end.,1
Adding a new vertical to streaming video may help Netflix give investors a new reason to bet on the company's future growth.,1
But it also potentially cuts at a long-held Hastings' tenet: that focusing on movies and TV shows is what sets Netflix apart.,1
"""What we have to do is be the specialty play,"" Hastings told CNBC in 2017.",1
"Boeing is overhauling some of its management structure in an effort to streamline and integrate functions, improve cost efficiency and better prepare the company to succeed after the coronavirus pandemic.",1
"“We will recover from this crisis, but positioning ourselves now for what will be a significantly smaller, and more competitive, industry after the pandemic subsides requires us to resize, reshape and continuously review our business – starting at the top with our leadership structure,” says a Boeing official.",1
"The overhaul, announced 21 April, includes formation of a new group called “Enterprise Operations, Finance and Strategy”.",1
That division will be led by chief financial officer Greg Smith and tasked with streamlining Boeing’s operation and improving productivity and supply chain health.,1
"Boeing senior vice-president of manufacturing, supply chain and operations Jenette Ramos will take on a “special assignment in support” of Smith’s new group.",1
"“This new global organisation will embed operational excellence and consistent lean principles across Boeing and its supply chain, and restore production and supply chain health as Boeing and the broader aerospace industry recover from the COVID-19 pandemic,” Boeing says.",1
"The restructuring will also see Boeing combine its legal and compliance programmes, which include functions such as global trade controls, ethics and business conduct.",1
"Led by Boeing chief legal officer and executive vice-president of global compliance Brett Gerry, the new legal-compliance division will “help the company proactively address new legal and compliance obligations arising from an increasingly complex global regulatory environment”, Boeing says.",1
"Boeing says the changes will simplify its management, improve efficiency and make Boeing’s corporate infrastructure more cost effective.",1
The restructuring follows Calhoun’s announcement earlier this month that Boeing would need to transform to align with an industry changed by the coronavirus.,1
"“When the world emerges from the pandemic, the size of the commercial market and the types of products and services our customers want and need will likely be different.",1
"However, revenue growth turned into revenue decline shortly after the IPO as competition emerged and Groupon's popularity faded.",1
"After several years of declining revenue, Groupon is attempting to turnaround its business by moving away from the heavily discounted coupon vouchers that made it famous toward a less discount-driven user experience that encourages more habitual use.",1
Groupon is also investing in partnerships to increase the number of deals available on its platform.,1
Will these changes stem Groupon's declining sales and keep the platform relevant?,1
"Recently, however, the company has introduced card-linked deals and booking requirements that allow for a more seamless user experience.",1
"By making Groupon easier to use, the company hopes that customers will use the platform more frequently.",1
The company introduced card-linked deals in 2018.,1
This new way to use Groupon requires customers to link a credit card to their Groupon account to get cash back after they buy a good or service advertised on the platform.,1
"Unlike Groupon's legacy voucher model, customers taking advantage of card-linked deals don't pay until the point of service and can use deals an unlimited number of times (as long as the deal is still active), but card-linked deals tend to carry smaller discounts than Groupon has typically featured.",1
Groupon has also made changes to its legacy voucher-based coupon product by requiring booking appointments for certain coupon categories.,1
"Booking appointments is in lieu of using a coupon voucher, which aims to create a more natural interaction between customers and businesses.",1
The bottom line is that Groupon has been tweaking its core products to enhance the customer experience and encourage more frequent use.,1
Groupon is probably onto something because it has studied its customer behavior for years and has a good sense for what will improve the platform.,1
Groupon has invested to ensure both sides of its marketplace find value on the platform.,1
"To increase the number of buyers on its platform, the company invested nearly $400 million on marketing last year.",1
"This marketing spend consisted of paid online advertising, such as search engine keywords, as well as offline advertising, such as TV commercials.",0
"In a new effort to increase the number of sellers, Groupon has forged partnerships with other marketplaces.",1
Groupon splits the fees it collects on transactions sourced from marketplace partners.,1
"Although fee-sharing makes these deals less profitable, Groupon is betting that the massive increase in available offerings will make the overall marketplace more worthwhile for consumers.",1
"If there are fewer people browsing for deals, the marketplace will be less lucrative for businesses.",1
"By making investments across both buyers and sellers, Groupon is enhancing the health of its marketplace, creating a better customer experience.",1
"Aside from Google and Yelp, consumers do not have many options for discovering local businesses.",0
Groupon is adjusting its approach to both the end consumer and to businesses in order to enhance the customer experience and improve the health of its marketplace platform.,1
"However, the new effort to improve the user experience and make bold bets on new products is a sign that the company is taking the challenge seriously.",1
The biggest is targeting multi-unit franchise owners.,1
The company said that it hopes to lure these operators into the system through potential acquisitions of existing restaurant portfolios.,1
"It believes that a new design, flexible footprint, brand awareness and low startup costs can help lure these operators into the system.",1
"“Historically, Subway has been a system of primarily single-restaurant operators,” Steve Rafferty, SVP of development for the Milford, Conn.-based company, said in a statement.",1
"Subway has traditionally targeted lower-cost, inline locations for development.",1
Subway also says it is focusing on international growth.,1
"The company says it has signed eight master franchise deals and development agreements that could add 5,000 locations around the world in years to come.",1
"But it’s the focus on multi-unit franchisees that remains the more notable effort for the brand, whose average operator owns just two locations—most of which are low-volume restaurants.",1
"The typical Subway averages about $430,000 in revenues per year, according to data from Restaurant Business sister company Technomic.",0
"Since the brand peaked at about 27,000 domestic locations in 2014, about 6,000 locations have closed down, most of those in the past three years—including 1,000 last year.",1
"Subway believes larger-scale franchisees could have more wherewithal, which could enable them to fund remodel projects or expansion.",1
One problem for the brand is its low unit volumes.,0
"The company says that 75% of the system, featuring more than 15,000 locations, were up an average of 8.2% over 2019 levels in the first three months of 2022.",0
How does going digital change a legacy retail brand?,1
"According to Barbara Martin Coppola, CDO at IKEA Retail, it’s a challenge of remaining fundamentally the same company while doing almost everything differently.",1
What does it mean for one of the world’s most recognizable retail brands to go digital?,1
"For almost 80 years, IKEA has been in the very analogue business of selling its distinct brand of home goods to people.",0
"Three years ago, IKEA Retail (Ingka Group) hired Barbara Martin Coppola — a veteran of Google, Samsung, and Texas Instruments — to guide the company through a digital transformation and help it enter the next era of its history.",1
How is the digital transformation at IKEA changing how the company actually operates in the day-to-day?,1
We have transformed our stores to also act as fulfilment centers.,1
"Ecommerce is open 24 hours a day, while traditional stores are not, which means we’ve needed to learn how to operate at two speeds, while operating from one space.",1
We’re rapidly expanding data and analytics and changing how they’re embedded in decision making.,1
"With the pandemic and with the closure of approximately 75% of our stores, we ramped-up and accelerated even more as people turned online and towards digital solutions.",1
"We are transforming our business: We are exploring potential new offers to customers, new ways to bring our offers to customers, and new ways to operate our business.",1
"And in order to be successful, digital needs to be embedded in every aspect of IKEA.",1
"Now, this process is a bit like an iceberg.",0
"At the top of the iceberg, we have the customer needs and adaptation — revamping everything around customer interaction and new purchasing journeys — and under the surface we are making huge changes to our business and operating model.",1
"We are revamping customer interactions both digitally and, in the store, and we’re connecting them.",1
It also requires a different way of operating to fulfill the goods to be bought.,1
"It requires reengineering of the full value chain, which needs to be governed by data and become more flexible than before.",1
"The result is meant to be a seamless, consistent customer experience.",0
"These transformations are happening at many layers within the company, and they require a multi-year strategy and a clear North Star to follow.",1
How has your strategy changed as you moved through this process?,1
The scope of the strategy has increased significantly over time as the company realized that digital needs to be embedded into everything we do.,1
