"They understand that once the bidding on a deal gets up to a level where we no longer can hit our return, we move on.",1
"During due diligence, we assess their potential with the same metrics we use in our daily business.",0
"Boeing senior vice-president of manufacturing, supply chain and operations Jenette Ramos will take on a “special assignment in support” of Smith’s new group.",1
"Having established itself in an era when supply chain management was a matter of moving boxes from here to there, the Lego Group had missed a sea change as retail giants like Wal-Mart and Carrefour gained dominance.",1
"Salespeople keep in close touch with customers, so they can estimate the order numbers with a smaller variance than if they were relying only upon forecasts.",1
"While the bundled pricing strategy is only a test, and it's unclear if and when Peloton would incorporate this idea permanently, BMO Capital Markets analyst Simeon Siegel raised questions about the damage it could do to Peloton's financials and to its brand image.",1
"Next came incentives; we had to change the way that we motivated and rewarded people, to emphasize employee engagement and customer satisfaction.",1
"Our first focus was on revamping all meetings with the customer, especially online with new and improved navigation and search function.",1
"Over the next year, Netflix plans to charge accounts that are clearly shared with users outside the home additional fees.",1
"When McCarthy took over as CEO, he wrote in a memo to employees that Peloton had to find ways to drive growth.",1
"“Historically, Subway has been a system of primarily single-restaurant operators,” Steve Rafferty, SVP of development for the Milford, Conn.-based company, said in a statement.",1
It changed its name to Qingdao-Liebherr to evoke the prestige and quality of German manufacturing.,1
Building the ability to monitor and progressively reduce emissions on the path to net zero will create an opportunity for players to differentiate.,1
"We want to provide customers with understanding, control, and the ability to make decisions about their data, so we added a functionality that lets consumers edit their data in the app at any given time.",1
"For example, we used to expect our store clerks to be efficient.",0
Jim Lico: That Jake Brake plant is still a Danaher subsidiary.,0
"Given the volume of capital that has already been committed to achieving net zero, firms that are able to decarbonize will have an advantage in attracting capital.",1
"Yes, it had taken the company years to establish its reputation as that ""third place.""",1
Some observers speculated that the Lego Group had overdiversified its product line with moves into such areas as apparel and theme parks.,1
"Americans are eager to spend on clothes, toys and home decor.",0
"New rivals entered the market, such as third-party pharmacy benefits management companies that deliver prescriptions by mail.",1
"While other media companies, such as Disney, have lagged because of a conglomerate discount and slow-growing or declining legacy assets, investors have loved Netflix's one-trick pony: streaming growth.",1
"These transformations are happening at many layers within the company, and they require a multi-year strategy and a clear North Star to follow.",1
"Comas: In 1989, the Rales brothers hired George Sherman to become CEO.",1
But those standards have long reflected a bias in favor of white women.,0
"“It gives us a wonderful image that most companies would kill for,” Ralph S. Larsen, the company’s chairman at the time, told Forbes in 2001.",0
"The fourth-largest toymaker in the world at the time (today it is fifth-largest), the Lego Group sold €1 billion (US$1.35 billion) worth of toys in 2004, ranging from its snap-together bricks for young children to Mindstorms, a line of do-it-yourself robot kits for older kids.",1
"Haier reps are trained to look up the complex data on China’s water problems, which vary by neighborhood, and to install the filters that guard against that neighborhood’s mix of chemicals and pollutants.",1
"But with that emotional connection firmly in place (and the data to prove it), Starbucks leadership had the confidence needed to make adjustments that it hopes will allow the brand to become more efficient and improve customer experience.",1
"General Motors and Ford are investing $65 billion between them – $35 billion at GM and $30 billion for Ford – and, so far, don't propose to borrow any of it.",1
“Where’s Francelle?,0
"“We are creating a much deeper and granular level of understanding of our consumers, who they are, their needs and their behaviors,” Mr. Abrams-Rivera said.",1
"If a customer can find a lower-priced ticket, Southwest Airlines matches the price.",1
"The rebrand has been panned for many reasons: it’s a foolish attempt to distract from the criticism the company has recently faced; the metaverse that the new name refers to is not well-known or understood, so it’s confusing; Meta is a stupid company name, etc.",1
The known was that we needed to be a leader in electric vehicles.'',1
"Tesla's first EV factory in California was financed with a loan that was federally guaranteed in 2010, when the EV market was nascent, before the company went public or had material revenue.",1
"Even in the digital age, its toys maintained a surprisingly firm grip on the market and seemed to adapt well to changing tastes.",0
But it’s worked the other way.,1
Haier’s role in this new world will be as a pathfinder: It’s already the first leading global consumer manufacturing company from China.,1
"This will enable Ericsson to capitalize on the convergence of cloud, software and services.",1
"…And that's going to allow us to be more efficient with our capital and more efficient with the labor and the assembly plants.""",1
"We called it “seven by 10,” meaning we wanted to have 7,000 stores by 2010.",1
Facebook’s decision to rebrand is an ill-timed move but not for the reason you might think.,1
"After several years of declining revenue, Groupon is attempting to turnaround its business by moving away from the heavily discounted coupon vouchers that made it famous toward a less discount-driven user experience that encourages more habitual use.",1
To that end—and in addition to all my other creative meetings—I am establishing a new standing monthly meeting with our senior creative leaders to discuss the opportunities we face as a storytelling enterprise.,0
The designers seemed to take those words to heart.,0
"In addition, Peloton will optimize its logistics network by reducing its owned and operated warehousing and delivery footprint, while scaling third party relationships.",1
"Although it’s sometimes compared to a private equity firm, Danaher is different — it buys and builds companies for the long term, not for rapid fix-up and sale.",1
"Today, newer technologies also make low-carbon heating and cooling systems, such as heat pumps and energy-efficient air conditioning, more cost competitive in many markets and climates.",0
We bring people together and make magical memories that last a lifetime at our parks and on our cruise ships.,0
"Since 2011, it has held the largest worldwide market share in white goods.",0
"If we don’t like the market, we don’t bother looking at specific companies.",1
"Arriving at this point, however, was difficult in two ways: The negotiations were long and difficult, and the impact on the company’s workforce had to be managed with great care.",1
Siemens said it sold only five large gas turbines in the quarter and warned of further market declines.,1
"“We focused on capabilities, processes and disciplines that, in many ways, were new to Kraft Heinz, but not necessarily new to the world.",1
"""We're not trying to shut down that sharing, but we're going to ask you to pay a bit more to be able to share with her and so that she gets the benefit and the value of the service, but we also get the revenue associated with that viewing,"" Chief Operating Officer Greg Peters said during the same call, adding it will ""allow us to bring in revenue for everyone who's viewing and who gets value from the entertainment that we're offering.""",1
"Real-estate players may, for example, create specific funds for net-zero buildings or investment themes that support community-scale decarbonization.",1
At least one Wall Street analyst has already questioned whether the new pricing plan could end up weighing on Peloton's brand and finances.,1
"When CEO Satya Nadella set out to remake the company and address its critics, the company embraced AI, mobile, and cloud-first strategies; opened itself up to partnerships (e.g., Linux); aggressively pursued acquisitions (e.g., LinkedIn); and implemented digital transformation across its operations.",1
They give us a better understanding of users’ needs.,0
"Sony will employ aggressive capital investment in these areas, with the aim of achieving sales growth and profit expansion.",1
"We have here a great case study in how businesses can stay relevant, and take advantage of a negative situation to make positive changes.",1
"When she left for Ulta’s corner office in 2013, he followed her.",1
"However, revenue growth turned into revenue decline shortly after the IPO as competition emerged and Groupon's popularity faded.",1
"Subway has traditionally targeted lower-cost, inline locations for development.",1
"A cluster of major corporate headquarters was not directly affected, but the transportation arteries to and from the area were.",0
"Bigger doesn't always mean better, but it usually does mean safer when it comes to investing.",0
"Siemens said it expects paring its number of business units will increase the company’s annual growth rate and profit margin for its industrial business by 2% over what it called the “medium term,” or the next three to five years.",1
"He slammed the brakes on Johnson’s strategy, and reinstated coupons and old brands.",1
"You go to people down in payables for a day sales outstanding [DSO] number, and they say they don’t have it.",0
"This could require detailed modeling of physical hazards (for example, projected changes in flood risks as the climate changes) or macro- or microeconomic modeling (for example, projected GDP impacts based on the carbon price impact on a local geography’s energy production mix).",0
"Joseph Thomas, a Penney spokesperson, pointed to same-store sales growth last quarter as proof the brand still resonates with shoppers.",0
"The most respectful way to navigate through this transition, they reasoned, was to adopt a strategy of complete transparency.",1
How much of being a successful CDO is addressing cultural and human issues?,0
"By carefully selecting the territories and product areas it targets, Sony will seek to limit its capital investment and establish a business structure capable of securing stable profits.",1
We have transformed our stores to also act as fulfilment centers.,1
But it also potentially cuts at a long-held Hastings' tenet: that focusing on movies and TV shows is what sets Netflix apart.,1
"McCarthy has already made it very clear, too, that prices could fall further as he aims to grow Peloton's user base beyond the Covid pandemic.",1
"""As the largest investment firm in the world, it was very clear to me that more and more clients are looking for advice from us,"" Fink said.",0
"Since making that comment in 2020, Hastings has watched other streaming services, including Warner Bros.",1
We set up kaizen [continuous improvement] sessions and policy deployment [PD] reviews for every business.,1
"Looking to recoup, Western manufacturers cast covetous eyes on China’s emerging market.",1
But consolidating logistics providers really just brought the Lego Group in line with what many of its competitors had done years ago.,1
"Cohen, however, isn’t counting on a comeback.",1
"It would make you wonder why we didn’t give up a lot sooner, but the model has proved successful.",1
"Instead of directing the employees who did that work, the ZZJYT managers became service providers to them, giving them the resources and guidance they needed to provide for customers.",1
Groupon splits the fees it collects on transactions sourced from marketplace partners.,1
"For example, a building supplied by a carbon-intensive energy grid or a carbon-intensive transportation system is exposed to the transition risks of those systems as well.",0
"Danaher had built itself into a remarkably successful business over four decades by acquiring and integrating new companies into a unified whole, improving them through a group of distinctive management practices known as the Danaher Business System (DBS), then holding onto them.",0
"This will change the structure of our economy and impact the value of the markets, companies, and companies’ locations.",1
"Can you elaborate a bit on how to make sure the vision for the company remains consistent, even as you’re enacting fundamental changes?",1
"We publicly announce the return metric we want to see within a stated time period, and how we think we’re going to get there.",1
The new corporate strategy and reporting structure builds on the Company’s strengths and investments.,1
"Following the success of Burger King’s Impossible Whopper, which features a vegan patty with a tenth of beef’s carbon footprint, McDonald’s announced its own “McPlant” burger this past fall.",1
"“We are also changing our innovation approach, switching to fast test and learn and then scale fast versus an immediate big launch,” he said.",1
"""Probably the most important inference from my observations is I believe we are just beginning a major reallocation of capital.""",1
We talked to experts on pricing and pricing analysis.,0
"To Zhang and others at Haier, this organization design represents an explicit effort to avoid being disrupted by technological change.",1
"We’ve been testing VR in the store, to visualize how a piece of furniture fits in a room.",0
We do not expect factory teams to be impacted by these changes.,0
"In addition, to serve its many small customers, the Lego Group had developed a multiple-tier inventory system with local centers; it was very difficult to position the right product in the right distribution center, a challenge that contributed to missed sales and high inventory levels.",1
We had to focus our frontline and field leadership on coaching employees and creating the right customer interactions.,1
"Southwest is always looking for lower-cost solutions, and that is more important than ever before.",1
But the really big announcement is the reason behind the closures.,1
"If they’d been conventional manufacturing guys, it wouldn’t have made sense to them.",1
Or a cell diagram presented by someone who can’t walk you through it when you ask them to.,0
"Lisa Davis, who has been leading the underperforming power and gas division, has been tapped to lead the new Gas and Power unit.",1
"The process is not unlike choosing the accessories on a new car, except that there tend to be more choices.",0
"And third, relentless focus on our audience.",1
We are on track to launch Haleon in mid-2022 and our business momentum is strong.,1
"As rivals adopted digital strategies and invested to improve their store experiences, Penney’s financial distress gave it little room to spruce up stores, buy trendy merchandise, and hire more employees.",1
"DEERFIELD, ILL. — It was only six years ago when Kraft Foods spun off Mondelez International to create one of the largest snack-centric companies in the world.",1
"In Pictures, Sony will focus on increasing its audience, and for Music it will centre growth on burgeoning areas such as the streaming music market.",1
"Although Penney is known best for selling clothes, it turned to Marvin Ellison, a former top executive at Home Depot, to lead it into the appliance business.",1
"By capitalising on its existing technological expertise in these areas (rather than engaging in large-scale investment), and by optimising fixed costs and enhancing inventory control, Sony will target a profit maximisation and return on investment.",1
Each team worked out its cross-functional plans through lengthy workshops.,1
Our name is grounded in our purpose to deliver better everyday health with humanity and to be a world-leader in consumer healthcare.,0
"“We know historically, beauty has had unattainable standards.",0
"In 2020, BlackRock held a substantial stake in approximately 91% of S&P 500 companies and across these companies that position averaged 7.7%, according to data compiled by Jackie Cook, director of sustainable stewardship research at Morningstar, based on annual proxy reports.",0
"Now, this process is a bit like an iceberg.",0
How is the digital transformation at IKEA changing how the company actually operates in the day-to-day?,1
The connection to customers has helped Haier migrate many people from their medium-value line of household appliances (the original Haier) to the more upscale Casarte brand.,1
"And the companies have cut billions in annual costs, by slashing whole lines of unprofitable sedans, withdrawing from unprofitable markets overseas, and focusing tightly on trucks, which remain the most profitable part of their business.",1
"You want them to rise to the challenge, adopt stretch objectives, and seek to improve.",1
That’s what creates competitive advantage.,1
"Instead of relying on a real estate play—location, location, location—we focused on improving the customer experience.",1
"He approached this challenge by adopting Mao Zedong’s strategy of “occupying the rural areas to encircle the city,” gaining strength first with niche products for sectors where there were few competitors.",1
"Zhang often takes his own notes, and he frequently applies the concepts to Haier — first in small experiments, and then rolled out through the company.",1
Peloton's average net monthly connected fitness churn was 0.79% in the latest period.,0
"In the 1990s, as competitors focused on regearing for the big-box stores, the Lego Group considered its primary challenge to be brand building — despite the fact that its bricks were already among the most recognized toys in the world.",1
"Most Chinese families lacked basic home appliances, and the offerings from local manufacturers did not meet basic standards for quality or consumer appeal.",0
"Customers choose the color combinations, features (such as the number and layout of shelves in the refrigerator), and ancillary design elements (like the pattern of sparkles on a high-end appliance).",0
The Internet connection also makes customers more likely to buy a water purifier — which is sold only by consultation.,1
"The local distributor sent a technician to the farmer’s house, where he discovered that the farmer had been using the washing machine not to wash clothes but to clean sweet potatoes.",1
"Demand from the £150 billion consumer healthcare sector is strong, reflecting an increased focus on health and wellness, significant demand from an ageing population and emerging middle-class, and unmet consumer needs.",0
"More importantly, the success of the sourcing project created a sense of optimism and the momentum to move ahead with other changes.",1
"(the Danaher Business System): This capability drives operational improvement of quality, service, reliability, and cost, generating above-market growth and profitability.",0
Reports in June of this year said Siemens might consider selling its turbine unit.,1
"Instead, we continue to explore many acquisitions and bring a significant number to fruition.",1
We look for large global markets with good growth profiles and generally low cyclicality.,0
"We had recognized years before that although Walgreens had centralized processes for functions including HR, IT, employee relations, and finance, we couldn’t make all those decisions at the corporate level.",1
"""We're working on how to monetize sharing.",1
Key Takeaways Southwest Airlines is more flexible than most other large airlines.,1
We thought they would kill our new approach.,1
"Not only would this presumably make the big clients happier, but the retailers’ strong forecasting and replenishment technol­ogy would give the company marketers access to a greater level of insight into buyer behavior than the company had on its own.",1
What made those problems especially hard to identify was that they grew out of the company’s core strengths: its capacity for innovation and its commitment to quality.,0
"In 2004, the family that had founded and run the Lego Group knew they had to change direction.",1
Netflix has benefited from being a pure-play streaming company for years.,0
"We can now build on this and drive a more sustainable, higher-quality earnings growth approach.”",1
"We are revamping customer interactions both digitally and, in the store, and we’re connecting them.",1
"The new Weybridge campus is expected to open at the end of 2024 and, alongside being the new company’s corporate headquarters, will be a centre of R&D and innovation, and home to a new state-of-the-art Shopper Science Lab.",1
"It will be up to “Meta” and Mark Zuckerberg to prove that this switch wasn’t an obvious crisis communication strategy to divert from the crises plaguing Facebook, and that it backs up its rebranding explanations for the switch with real value for consumers and shareholders,” he concluded.",1
"Those were the very advantages that the company’s leaders had relied on at first to reverse the profitless streak, hoping the company could innovate its way out of trouble.",1
The company regained public trust by quickly pulling Tylenol from American shelves and introducing new tamper-resistant packaging.,1
"Show creators would ask us, 'Do you want to see notes?",0
"This follows employee protests and walkouts in recent years against sexual harassment, migrant detention, and discrimination.",0
We customized what we learned to fit the Danaher culture.,1
"“We recently reinvested in the brand, differentiated it more from competition, and we improved its in-store visibility.",1
Walt Disney Co. CEO Bob Chapek outlined three “strategic pillars” for the company going forward in a memo to staff Monday.,1
"George Koenigsaecker: The Danaher Business System was born in 1986, when I was the president of the Jacobs Manufacturing Company in Bloomfield, Conn. “Jake Brake” was a formerly family-owned business that made brakes for diesel trucks.",1
"Sure, we want to monetize what we bought, just as much as private equity does, but we do it in a very different way.",1
Still to be revealed this year will be the Company’s new stock ticker symbol aligning with the ASAP rebranding.,1
The database allows the company to evaluate how consumers snack across different emotional or functional needs and occasions.,0
Management changes also are in the offing.,0
"To support the seven-by-10 strategy, we had some well-refined capabilities.",1
"The executives understood that, for the initiatives to stand any chance of success, the Lego Group needed to preserve the loyalty of its workforce, even as the move to a more global supply chain did away with many jobs.",1
"That approach may be successful in some companies, but not at Danaher.",1
"When we bought Tektronix and some of the life sciences businesses, we learned more about technology development, advanced R&D, and software development.",1
It is searching for a CEO to replace Ellison and focusing on women’s clothing as it works to clear its inventory of brands that have gone out of fashion.,1
"ASAP’s new vision is delivering to consumers, same day, from any type of business.",1
But they worked so well in the pilot that we rolled them out to the entire company.,1
"Transition risks include changes in the economy, regulation, consumer behavior, technology, and other human responses to climate change.",0
"""Then you realize you have to rip that revenue away from other places because the total ad market isn't growing, and in fact right now it's shrinking.",1
"“We are still trying to fully recover from the self-inflicted wounds of the previous strategy,” Ullman said in early 2015, before he stepped down as CEO.",1
Penney ditched top private-label brands with loyal followings and introduced new ones that had little relevance to low- and middle-income customers.,1
"Given that each district manager oversees almost 1,000 people, managing, developing, and operating the business can be a challenge.",0
"Ackman and real estate investment firm Vornado bought up a chunk of Penney, forced Ullman out and installed a new leadership team.",1
"His lengthy list of to-dos includes an expansion into new functions, like ad sales, and new demographic markets as beauty consumers change how they shop.",1
"And the number of SKUs multiplied every year, increasing that backlog.",0
"LAFAYETTE, La.--(BUSINESS WIRE)--Waitr Holdings Inc. (Nasdaq: WTRH) (“Waitr” or the “Company”) today announced it has changed its name to ASAP, signaling a new “deliver anything” business model.",1
"The process started with an examination of one aspect of the company’s supply chain complexity and an analysis of its impact on productivity, planning, and control.",0
"The company leadership knew it had to address those problems, and that the supply chain posed the most immediate opportunity for improvement.",1
"In the past, organizations often relied on one-off IT projects and applications to address business needs.",0
"Inspired, the company soon released a vegetable washing machine, designed to accommodate the extra grime and soil of the tubers.",1
