"To provide talent for the ZZJYTs, Haier created an internal labor market.",1
"We must evolve with our audience, not work against them.",1
"Chief Purchasing Officer Niels Duedahl was tasked with overseeing the process, supported by a team of analysts who built detailed cost models.",0
"For example, the company now uses Internet access to customize every product it sells in China, whether bought in a store or online.",1
"As investors who helped launch Bain Capital’s social impact fund, we applaud the commitment to reorient business toward the greater good.",1
"Physical and transition risks can affect assets, such as buildings, directly or indirectly, by having an impact on the markets with which the assets interact.",0
And companies respond.,1
"Retailers like Walgreens,Walmart and of course, Sephora, are making a bigger play for the market, delivering a faster cadence of new beauty brands at all price points.",1
"Over many years leading up the change, Google’s business had expanded well beyond its search engine product.",1
This has helped us a lot when going through our transformation.,1
Manufacturing.,0
We recently acquired a California company by the name of Geomagical Labs.,1
We send Danaher experts into that business for an eight-hour operating review every month.,0
"""Does Peloton become a winter experience for customers who every year rent the bike for four months, and then give it back when the weather's nice?",1
A possible spinoff or partnership for these divisions seems likely.,1
"We help deliver end-to-end tech-enabled transformations for our clients by focusing on IT infrastructure, architecture, data, operations, and overall technology strategy.",1
"Recently, investors made net-zero commitments, regulators developed reporting standards, governments passed laws targeting emissions, employees demanded action, and tenants demanded more sustainable buildings.",1
That would get us a 3 percent productivity gain.,0
"Fabian Garcia, President North America, has been appointed President Personal Care, responsible for Skin Cleansing, Deodorants, and Oral Care.",1
"The name was also announced in advance of GSK hosting a Consumer Healthcare Capital Markets Day for investors and analysts on Monday 28 February, to provide details on the overall strategy, capabilities and operations of Haleon, including detailed financial information and growth ambitions of the business.",1
But what if you didn't have any changes planned?,0
"Every day, workers tracked quality results using paper and pencil, and their wages were tied directly to the outcomes.",0
We had to do this if we wanted to scale up.,1
"An even bigger challenge was the growth of Internet pure plays, like Amazon and Google, which sell most of what we carry.",1
It now has to prove to a skeptical public that early optimism in the company was justified.,1
IKEA originates from the south of Sweden.,0
"By adopting a brand name that is based on future potential capabilities and a platform and products that, by Zuckerberg’s own admission, may not be established for nearly a decade, the company sets itself up to confuse people at best; at worst, it will disappoint people and further degrade their trust in the company.",1
"“I was in beauty and, frankly, not by choice,” he says.",0
Real-estate firms can use their physical presence to generate and store energy.,1
These episodes represented the start of the second reinvention at Haier: a new form of customer-responsive innovation.,1
"Over the years, the company had evolved from a highly leveraged startup to a profitable family of ventures with a market capitalization of more than US$40 billion in 2013.",1
"There will be increased investment in image sensors, as well as enhanced R&D in the area, expanding their applications in everything from smartphones to medical treatment.",1
"Well, now's the time to take a long, hard look at your business, both pre- and post-pandemic.",1
"The company entered the business through a joint venture with the Strauss Group, an Israeli technology firm, which provided the technology while Haier focused on marketing, distribution, and service.",1
"The company’s $1.5 billion three-door refrigerator business is now led by the winner of that competition, 38-year-old Pu Xiankai.",1
"Just 30 products generated 80 percent of sales, while two-thirds of the company’s 1,500-plus stock keeping units (SKUs) were items that it no longer manufactured.",1
"What makes this idea so radical is the fact that Starbucks built much of its brand on being what former CEO Howard Schultz described as a unique ""third place,"" the place between work and home that customers could go to meet friends, get work done, or simply hang out.",1
"We know there will be challenging times, but we also know there is something bigger than our own reality, it helps us put energy and heart into creating an IKEA for generations to come.",0
Netflix has previously argued it found a gap in the market by not worrying about advertising.,1
"In a new effort to increase the number of sellers, Groupon has forged partnerships with other marketplaces.",1
"In contrast, its main rival Sephora, which is owned by LVMH, skews higher end and almost never operated in strip malls until its partnership with Kohl’s last year.",1
"Peloton confirmed to CNBC that on Friday it will start to trial a new pricing system, where customers pay a single monthly fee for both their workout equipment and for access to Peloton's on-demand fitness classes.",1
Netflix's resistance to weekly scripted release may be the next thing to go.,1
"Peloton also announced Thursday that it has hired Andrew Rendich, former chief operating officer of the e-commerce company Grove Collaborative, as its chief supply chain officer, effective next week.",1
"They approached it holistically, analyzing every aspect of the company’s product development, sourcing, manufacturing, and distribution.",1
Product Development.,0
"With the mandate for change clear, Knudstorp spent his first weeks as CEO working closely with Kristiansen and the other members of the board and the leadership team to pinpoint the source of the company’s problems.",1
"First, for each of our 30 U.S. markets, we created a position called vice president for markets, located in the field (the local geography).",1
It’s strange—people have an emotional connection to a cup of coffee.,0
Chapek’s memo comes as Disney prepares to celebrate its 100th anniversary in 2023.,1
"They have both been instrumental in executing on our focused strategy and Ericsson’s turnaround”, says Börje Ekholm.",1
"The company’s leadership team recognized that even though transformation would be painful, it was imperative.",1
Exhibit 1 We strive to provide individuals with disabilities equal access to our website.,0
"Therefore, willingly embracing the concept of open innovation, they collaborate with organizations everywhere they operate — which is how the company ends up working with the best universities and research institutes in the world.",1
"The change is designed to accelerate the Company’s growth and optimize its financial performance by leveraging its core technologies, competitive position, and deep technical expertise in growing applications that increasingly require precision measurement solutions.",1
"The company is known for several distinctive capabilities: a precise understanding of consumer needs, especially in China and other emerging markets; the ability to rapidly innovate new types of appliances that meet those consumer needs; the management of complicated distribution networks, a skill honed in the complex Chinese market; and a high level of execution ability, including the automation of factories to deliver products to consumer specification.",0
How does going digital change a legacy retail brand?,1
"The company pioneered connected, technology-enabled fitness, and the streaming of immersive, instructor-led boutique classes for its Members anytime, anywhere.",1
"“In other words, we are building a more powerful engine to supercharge our operating model,” Mr. Patricio said.",1
"An ad-supported Netflix ""makes a lot of sense"" for ""consumers who would like to have a lower price and are advertising tolerant,"" he said.",1
“We’ve seen other companies like Google do this with the creation of Alphabet.,1
"Earlier this month, it began selling Rihanna’s Fenty Beauty line, which has been praised for offering cosmetics in an extensive array of skin tones.",1
Agile@Scale is how we will go about opening new growth opportunities and unlocking greater efficiencies.,1
"Later, it involved increasingly sophisticated forms of customization and new types of services.",1
Sixty-seven percent of all orders consisted of less than a full carton — an incredibly costly proposition that demands labor-intensive “pick-packing” at the distribution center.,1
"Giving people the permission to be human doesn’t make you less effective, in fact I see it as an important step to building trust.",0
"Even lingering affection for the company’s consumer products does not do much to advance Johnson & Johnson’s medical businesses, which are far more important to the company’s finances.",1
One problem for the brand is its low unit volumes.,0
"Hanneke Faber, President Foods & Refreshment, has been appointed President Nutrition, which will be home to Scratch Cooking, Healthy Snacking, Functional Nutrition, Plant-Based Meat, and Food Solutions.",1
"Important factors that could affect whether and to what extent any of our forward-looking statements materialize include, but are not limited to, the factors described in the section “Risk Factors” in the latest interim report, and in “Risk Factors” in the Annual Report 2021.",0
Groupon is also investing in partnerships to increase the number of deals available on its platform.,1
"By adopting a brand name that is based on future potential capabilities and a platform and products that, by Zuckerberg’s own admission, may not be offered for a decade, the company sets itself up to confuse people at best; at worst, it will disappoint people and further degrade their trust in the company.",1
"Comas: We might say to a company leader, “You don’t know us, but we’re interested in this space, and one day, if you think of selling your business, please talk to us.",1
"As a result, we evolved from simply filling prescriptions for people to becoming a single point of patient care, and a destination for health and daily-living products and services for our customers.",1
"The strategy will therefore see Sony shift to more profitable business areas, such as camera sensors, videogames and entertainment products.",1
Beckman is successful today because its leadership and the associates embraced DBS.,1
"To rebuild profitability, the company had to refashion every aspect of its supply chain.",1
The phrase “the information is more valuable than the product” has already become a slogan throughout Haier.,1
"The company on August 1 said it is buying Mendix, a Boston, Massachusetts-based industrial software company, for $700 million.",1
"I couldn’t think of a better combination, and I could not be more optimistic about our future.",0
"It's hand-to-hand combat to get people to spend less on, you know, ABC and to spend more on Netflix.",1
But then the competitive landscape changed.,1
"He later spent seven years in PepsiCo’s food business through 2008, followed by two at Seventh Generation, a Unilever division focused on eco-friendly household items.",1
"""With today's announcements, we are taking action to ensure Peloton capitalizes on the large, long-term Connected Fitness opportunity.",1
"First, the number of its logistics providers was cut from 26 to three or four — enough to ensure resilience and gain greater economies of scale while still encouraging competition among the suppliers.",1
"In another bid to win customers, Peloton recently extended its free at-home trial for its Bike, Bike+ and Tread machines to 100 days from 30.",1
"We are beginning to see consumers take up the cause, as they now expect companies to take a stand on social and environmental issues.",0
"To execute that strategy, however, we needed to redesign some components of the organization.",1
“The best cooks are not the ones who have all the ingredients in front of them.,0
"The Weighing Solutions segment is comprised of the force sensors, on-board weighing, and process weighing business lines.",0
Southwest Airlines' strategy emphasizes recruiting and retaining motivated employees.,1
"Furthermore, introducing new products every year is not necessarily a bad thing, but the Lego Group did not align its supply chain with that business strategy.",1
"Kaeser in a statement about the new business strategy said, “It would be irresponsible to rest on our laurels now.",1
"Booking appointments is in lieu of using a coupon voucher, which aims to create a more natural interaction between customers and businesses.",1
"Boeing says the changes will simplify its management, improve efficiency and make Boeing’s corporate infrastructure more cost effective.",1
"“This is clearly a shift in our value-creation model,” he said.",1
"Leading real-estate players will figure out which of their assets are mispriced and in what direction and use this insight to inform their investment, asset management, and disposition choices.",1
"For example, we were very good at managing real estate, including construction and analytics.",0
"But the diversification added layers of complexity, and the red ink continued to flow.",1
Groupon is adjusting its approach to both the end consumer and to businesses in order to enhance the customer experience and improve the health of its marketplace platform.,1
"The tremendous gains in efficiency meant that despite the impact of rising oil prices on materials and transportation, stock turnover increased by 12 percent in 2005, and the same year, the Lego Group recorded its first profits — €61 million ($72 million) — since 2002.",1
"“For the past five years, our cost focus has lifted the company to the next level.",1
At its helm they placed Chief Financial Officer Jesper Ovesen — a clear signal that this initiative was of the utmost importance.,1
"To escape its debt load, Penney would need to regain a chunk of the sales volume it has lost over the years, and do it at a profit.",1
Danaher’s innovation capability enables product development that meets the evolving needs of its diverse customer base.,0
"""Because sustainable investment options have the potential to offer clients better outcomes, we are making sustainability integral to the way BlackRock manages risk, constructs portfolios, designs products, and engages with companies,"" the firm's global executive committee, which includes Fink, wrote in its letter to clients Tuesday.",1
"Due diligence only goes so far, and we need the company management teams to play an integral role in defining a path for their future, in concert with us.",1
"“Putting all your eggs in one basket” might sound like a poor strategy to reduce risk, but consolidated distribution made inventory easier to track and made stock shortages far less likely.",1
"The company will move away from its current matrix structure and will be organised around five distinct Business Groups: Beauty & Wellbeing, Personal Care, Home Care, Nutrition, and Ice Cream.",1
CNBC reported earlier on how the password-sharing crackdown is likely to work.,1
We were very aware of what it had taken to build the strength of that brand over 100 years.,0
"But from a strategic point of view, the split makes sense.",1
The author argues that the real problem is that Facebook is re-branding before its vision is a reality.,1
"Ford and GM profits have held up, even though U.S. industry unit sales are off the 17 million-vehicle annual pace before Covid, because the companies aggressively cut costs to prepare for the transition, Nelson said.",1
"""This aligns with Peloton's belief that intuition drives testing and data drives decision making as the company sets course for the next phase of its evolution and growth,"" Lane said in an emailed statement.",1
It is an obelisk-like device with a small wind tunnel that draws air through it from the room where it is positioned.,0
"Leadership development: Through this capability, the company engages people in learning sophisticated management practices.",0
Simms: The culture evolved from the top.,0
"At each cost center along the supply chain, the transition team applied its new insight: Constraints don’t destroy creativity or product excellence, and they can even enhance them.",1
He’d write about that day’s kaizens.,0
"The company said it's divesting from companies that generate more than 25% of their revenue from thermal coal production — or coal used for power production — from its actively managed portfolio, which it hopes to complete by the middle of 2020.",1
"""For a company that has been plagued with logistic issues, they are now effectively allowing people to return their piece of equipment, at a moment's notice,"" Siegel said.",1
"With the pandemic and with the closure of approximately 75% of our stores, we ramped-up and accelerated even more as people turned online and towards digital solutions.",1
"Its hope is that people who already own a Bike or a Tread will buy more stuff within the Peloton ecosystem, including its own apparel.",1
"Should a user choose to cancel, Peloton would take back the Bike.",1
"- Facebook chief Mark Zuckerberg on Thursday announced the parent company's name is being changed to ""Meta"" to represent a future beyond just its troubled social network.",1
"He joined the beauty retailer as chief marketing officer and chief merchant in 2013 before becoming president in 2019, and then CEO last year.",1
"As ESG-focused investing has grown in popularity so, too, have critics of the style, who argue that the inherently subjective nature means there's little accountability.",0
"At the same time, the accelerating physical consequences of a changing climate are becoming more pronounced as communities face storms, floods, fires, extreme heat, and other risks.",0
"The company announced management changes ahead of the October 1 start of its Vision 2020+ plan, which replaces the company’s Vision 2020 outline adopted in 2014.",1
"At the same time, the operational team put a process in place to help designers make more cost-effective choices.",1
That was our business strategy.,0
This really drove accountability at the local level.,0
