Topic,Link,Title,Article
Moody's Rating,https://www.barrons.com/articles/fitch-keeps-ges-credit-rating-at-investment-grade-51566925097,Brazil stripped of investment grade rating as crisis deepens,"BRASILIA (Reuters) - Brazil lost its coveted investment-grade rating on Wednesday after Fitch became the second credit agency to downgrade the country’s debt to junk status, citing concerns about an economic and political crisis threatening to topple President Dilma Rousseff.Fitch downgraded Brazil to BB+ with a negative outlook less than 24 hours after the left-leaning Rousseff moved to loosen next year’s budget targets in a bid to safeguard spending for welfare programs. The decision undercut her orthodox finance minister, Joaquim Levy who staked his reputation on an austerity agenda that has now stalled in Congress.Levy blamed the government’s abandonment of targets needed to cut debt for Fitch’s decision.“Obviously the goal of zero (debt reduction) is very bad and resulted in the downgrade,” he told Band News TV late Wednesday.The real currency and dollar-denominated bonds tumbled amid forced selling after the downgrade, which came just three months after Standard & Poor’s cut Brazil’s rating to junk, further clouding the outlook for an economy reeling from its sharpest downturn in a quarter-century.Investors barred from owning junk bonds could dispose of about $20 billion in Brazilian sovereign and corporate debt after two agencies downgraded Brazil, analysts at JPMorgan Securities estimated in October.It marked a bitter reversal for Latin America’s largest economy, seven years after a commodities-fueled boom helped propel it to investment-grade status, feeding expectation that its economy would escape sharp cycles of boom and bust that has kept millions in poverty.Fitch said a deepening political crisis had restricted the government’s ability to right the economy. Rousseff’s opponents have accused her of breaking budget rules and are trying to impeach her, while key allies are threatening to bolt her coalition amid a widening bribery scandal at state-run oil company Petrobras.With Fitch leaving Brazil’s credit outlook on negative, and Moody’s Investor Services also reviewing its rating, further downgrades to the country’s creditworthiness could follow.“The impeachment proceeding is a setback,” Shelly Shetty, Fitch’s head of Latin American sovereign ratings, told Reuters after the downgrade. “Impeachment delays implementation of fiscal measures.”The Supreme Court on Wednesday was weighing the legality of impeachment proceedings against Rousseff after Congress packed a special committee with the president’s opponents in a secret ballot last week.Lower house Speaker Eduardo Cunha, who started the impeachment proceedings, was one of many lawmakers whose homes and offices were raided on Tuesday in the Petrobras probe, which has thrown Congress into disarray and delayed debate of key economic reforms.“It’s hard to be surprised by the Fitch downgrade. Political uncertainties prevent any clarity about the economic outlook,” Candido Bracher, chief executive of Itau BBA, the investment bank unit of Brazil’s largest private bank, told Reuters.‘SLIGHTLY SIDELINED’Following the downgrade, Levy said losing the investment-grade rating was “serious” and showed the government had not done everything required. He was silent when asked if he would stay on as finance minister.Levy set out to win back investor confidence this year with an unpopular austerity agenda but has faced fierce resistance from congressional allies and ministerial rivals, raising expectations for his resignation.Earlier on Wednesday, Levy said he felt “slightly sidelined” by Rousseff’s decision to water down a crucial fiscal savings target for next year.He downplayed the importance of impeachment.“In truth,” he told Band News, “It’s more important for us to understand this: What does the government want? What will it do, OK?”His comments and the Fitch downgrade added to market pressure from a widely anticipated U.S. interest rate hike on Wednesday, which has drawn investors away from riskier emerging markets like Brazil in recent months.The Brazilian real, fell about 2 percent in Wednesday trading. Dollar-denominated bonds also tumbled sharply, and five-year credit default swaps rose 28 basis points to 482 bps, according to data from Markit.“Local rates and currency will be under pressure in the next couple of days because of forced selling by index funds,” said Bernd Berg, director for emerging markets strategy at Societe Generale.Standard & Poor’s cut Brazil’s rating to junk in September, and Moody’s Investors Service put the country on review last week for a possible downgrade to that level.Fitch’s downgrade of the sovereign credit rating worsens the outlook for large corporate borrowers already contending with the rising borrowing costs, said Alberto Gallo, head of global macro credit strategy at Royal Bank of Scotland in London.Downgrades could drive up borrowing costs for large-scale borrowers such as iron ore company Vale SA and Petroleo Brasileiro SA, as Petrobras is known. The nation’s largest banks, such as Itaú Unibanco Holding SA and Banco Bradesco SA, may also face higher borrowing costs.This year, global bond offerings by Brazilian companies have plummeted 82 percent to about $5.7 billion, according to Credit Suisse Group AG data. Brazil has accounted for less than 9 percent of Latin American global debt offerings this year, down from 32 percent in 2014."
Moody's Rating,https://www.marketwatch.com/story/sp-raises-portugal-credit-rating-to-investment-grade-2017-09-15,Ford Loses Investment-Grade Status: What It Means,"Ford Motor Company (F 0.01%) has lost its investment-grade status. Standard & Poors cut Fords credit rating to BB+, one step below investment-grade, on concerns that the shutdown of its North American factories will hurt Fords margins and cash flow for an extended period.Fords return to investment-grade status in 2012, following the 2008-2009 economic crisis, was a hard-won goal for the company. It was rightly celebrated at the time. But with this downgrade, 2 of the 3 major credit-rating agencies now rate Ford below the BBB level -- meaning that the companys credit rating is now, technically speaking, junk.Heres what we know, and what it might mean.What S&P said about Fords credit ratingIn a short note released after the markets closed on Wednesday, S&P said that the coronavirus pandemic added to its existing concerns about Ford.The decision to downgrade Ford Motor Co. investment grade to speculative grade reflects that the companys credit metrics and competitive position became borderline for the investment-grade rating prior to the coronavirus outbreak, and the expected downturn in light-vehicle demand made it unlikely that Ford would maintain the required metrics.S&P said that the current rating has ""negative implications,"" meaning that theres at least a 50% chance that it could lower Fords rating further at some point in the near future. S&Ps analysts are waiting to see how long Fords factories will be shut down, and how severely demand for light vehicles will be impacted once they restart.A quick primer on corporate credit ratingsThere are three major agencies that rate corporate credit: S&P, Moodys Investors Service, and Fitch Ratings. If two out of the three rate a companys credit below the BBB level (or equivalent), the companys debt is considered ""speculative,"" rather than ""investment grade.""The implications are simple: The lower a companys credit rating, the more it will have to pay (in interest) to borrow money.""Junk bond"" is Wall Streets slang term for bonds with a speculative credit rating. Its most often used to refer to debt issued by companies with very low credit ratings (in the Cs, rather than the Bs), but it can apply to anything in the ""speculative"" range.S&Ps move follows cuts to Fords rating by Moodys and FitchS&P isnt the first to downgrade Ford -- in fact, its the third.Fitch Ratings downgraded Ford to BBB-, the very lowest level thats still considered investment-grade, in a note on Tuesday (March 24) that reflected the analysts concerns about what could happen after the pandemic subsides:Fitch currently believes the company has the financial flexibility to manage through an extended shutdown of its facilities, but concerns are increasing that a combination of an extended shutdown followed by weak demand in a global recessionary environment could further pressure the companys credit profile.Like S&P, Fitch warned that it could cut Fords rating further, depending on how things unfold over the next few months.Moodys, meanwhile, cut Fords credit rating to speculative levels last fall. In a note released on September 9, Moodys said that it had become concerned that CEO Jim Hacketts extensive restructuring of the company (what Ford calls a ""redesign"") is likely to cost billions of dollars just as the global new-car market appeared to be softening.Remember, this was in September of 2019:[T]he erosion in Fords performance has occurred during a period in which global automotive conditions have been fairly healthy. Ford now faces the challenge of addressing these operational problems as demand in major markets is softening, and as the auto industry is contending with an unprecedented pace of change relating to vehicle electrification, autonomous driving, ride sharing, and increasingly burdensome emission regulations.One of Moodys concerns at the time was that the economic waters were likely to get choppier before Fords redesign was completed. I think we can say that they were right.What does it mean for Ford investors?I know that this is a disappointment for Fords executives and employees. But for auto investors, Im not sure it matters a whole lot right now. Its not really a surprise to hear at this moment that Ford (and every other automaker outside China) is going to have a tough time until the coronavirus pandemic subsides -- and depending on the condition of the economies in North America and Europe when it does, possibly for quite a while after.This development means that Ford will have to pay more to borrow money, whether via credit lines or debt issues. But right now, that seems like a small drop in a very large bucket: The moves that Ford makes in the coming days and weeks to cut costs and restart its factories will matter much more to investors over the next little while."
Moody's Rating,https://www.autoevolution.com/news/moody-boosts-fords-credit-rating-to-investment-grade-45285.html,Tesla moves closer to ‘Investment Grade’ rating with S&P Global following Q1 showing,"ByTesla moved closer to the S&P Global’s “Investment Grade” rating after reporting a strong first quarter with a solid financial balance sheet, especially in terms of free cash flow, while navigating tough macro conditions in the sector.“S&P Global Ratings today said that Tesla Inc.’s first-quarter results (ended March 31, 2022) indicate solid execution and prospects for robust free cash flow in 2022 amid supply disruptions,” the organization wrote in a bulletin.Tesla’s Q1 2022 Earnings Call took place on Wednesday, where CEO Elon Musk and other executives outlined the automaker’s strongest performance in its short-but-storied history. Tesla posted over $18.7 billion in revenue, beating consensus estimates of $17.8 billion. It also beat EPS estimates of $2.27 by posting a nearly $1 beat at $3.22 per share.Perhaps the most impressive statistic of Tesla’s quarterly breakdown on its Shareholder Deck was its ability to navigate through global supply chain issues and chip shortages, two issues that have plagued many industries with automotive being amongst the hardest hit. Tesla said:“Challenges around supply chain have remained persistent, and our team has been navigating through them for over a year. In addition to chip shortages, recent COVID-19 outbreaks have been weighing on our supply chain and factory operations. Furthermore, prices of some raw materials have increased multiple-fold in recent months. The inflationary impact on our cost structure has contributed to adjustments in our product pricing, despite a continued focus on reducing our manufacturing costs where possible.”Despite the challenges, Tesla’s automotive division performed well above expectations by delivering 310,048 vehicles in Q1, a new company record. Its largest contributors to revenue generation were growth in vehicle deliveries, increased average selling price, and growth in other parts of Tesla’s business.Its performance in Q1 has the S&P nearly ready to promote the company’s stock to an “Investment Grade” rating. In October, the organization upgraded Tesla to a BB+ rating, but as the industry continues to expand, the company holds a competitive advantage. Tesla will have to improve one level, from BB+ to BBB, to be considered “Investment Grade,” by the S&P Global’s standards.“At this stage, Tesla appears to be in a very strong position relative to its competitors to raise its cell capacity and complete the ramp up of its production to meet demand,” the S&P Global Ratings wrote. “Specifically, we believe the electric vehicle (EV) maker is on track to increase its annual vehicle deliveries toward our forecast of roughly 1.5 million over the next 12 months, which follows its delivery of 936,000 vehicles in 2021 and over 310,000 in the first quarter of 2022. While competition is increasing with numerous launches of new EV models, we recently increased our EV penetration to reach 15%-25% of the global fleet by 2025, which should support Tesla’s ability to increase sales of its vehicles.”I’d love to hear from you! If you have any comments, concerns, or questions, please email me at joey@teslarati.com. You can also reach me on Twitter @KlenderJoey, or if you have news tips, you can email us at tips@teslarati.com.Tesla moves closer to ‘Investment Grade’ rating with S&P Global following Q1 showing"
Moody's Rating,https://citywireusa.com/professional-buyer/news/doubleline-reconsiders-its-aversion-to-investment-grade-corporates/a2388274,Microchip Technology Announces Receiving Investment Grade Ratings From Both Moody’s and Fitch,"CHANDLER, Ariz., Nov. 15, 2021 (GLOBE NEWSWIRE) -- (NASDAQ: MCHP) – Microchip Technology Incorporated, a leading provider of smart, connected, and secure embedded control solutions, today announced that it has received investment grade debt ratings from both Moody’s and Fitch.“We are pleased to have achieved this milestone of receiving investment grade ratings from both Moody’s and Fitch,” said Ganesh Moorthy, Microchip’s President and CEO. “Receiving investment grade ratings from both agencies is an important achievement that will enable us to execute on our recently announced capital allocation strategy to pay increasing cash dividends and initate stock repurchases under our new program that we announced last week. We look forward to continuing on our journey of returning capital to our stockholders.”Cautionary Statement:The statements contained in this release relating to enabling us to execute on our recently announced capital allocation strategy to pay increasing cash dividends and initate stock repurchases and continuing on our journey of returning capital to our stockholders are forward-looking statements made pursuant to the safe harbor provisions of the Private Securities Litigation Reform Act of 1995. These statements involve risks and uncertainties that could cause actual results to differ materially, including, but not limited to continued uncertainties related to the impact of the COVID-19 pandemic on the economy, our business, and the business of our customers and suppliers, actual cash flows generated from and used in the operation of ourbusiness; actual or projected levels of capital expenditures; our balance of cash and investments; changes in tax laws related to stock repurchases or dividends and any new laws which may be enacted; the impact of any significant acquisitions we may make; our ability to realize the expected benefits of our acquisitions, changes in demand or market acceptance of our products and the products of our customers and our ability to meet any continued increases in market demand; the mix of inventory we hold and our ability to satisfy short-term orders from our inventory; changes in utilization of our manufacturing capacity and our ability to effectively manage our production levels and increase production to meet any continued increases in market demand; our ability to obtain additional capacity from our wafer foundries and other suppliers to increase production to meet any continued increases in market demand; our ability to control the level of operating expenses relative to our level of revenues; competitive developments including pricing pressures; the level of orders that are received and can be shipped in a quarter; changes or fluctuations in customer order patterns and seasonality; the costs and outcome of any current or future litigation or other matters involving our Microsemi acquisition, the Microsemi business, intellectual property, customers, or other issues; the costs and outcome of any current or future tax audit or investigation regarding our business or the business of Microsemi; disruptions in our business or the businesses of our customers or suppliers due to natural disasters (including any floods in Thailand), terrorist activity, armed conflict, war, worldwide oil prices and supply, public health concerns (including COVID-19) or disruptions in the transportation system; and general economic, industry or political conditions in the United States or internationally.For a detailed discussion of these and other risk factors, please refer to Microchips filings on Forms 10-K and 10-Q. You can obtain copies of Forms 10-K and 10-Q and other relevant documents for free at Microchip’s website (www.microchip.com) or the SECs website (www.sec.gov) or from commercial document retrieval services.Stockholders of Microchip are cautioned not to place undue reliance on our forward-looking statements, which speak only as of the date such statements are made. Microchip does not undertake any obligation to publicly update any forward-looking statements to reflect events, circumstances, or new information after this November 15, 2021 press release or to reflect the occurrence of unanticipated events.About Microchip:Microchip Technology Incorporated is a leading provider of smart, connected and secure embedded control solutions. Its easy-to-use development tools and comprehensive product portfolio enable customers to create optimal designs, which reduce risk while lowering total system cost and time to market. The companys solutions serve more than 120,500 customers across the industrial, automotive, consumer, aerospace and defense, communications and computing markets. Headquartered in Chandler, Arizona, Microchip offers outstanding technical support along with dependable delivery and quality. For more information, visit the Microchip website at www.microchip.com.The Microchip logo and name are registered trademarks of Microchip Technology Incorporated."
Moody's Rating,https://www.cnbc.com/2020/03/31/south-africa-looks-to-structural-reform-last-investment-grade-credit-rating-falls.html,T-Mobile Secures First-Ever Full Investment Grade Rating,"BELLEVUE, Wash.--(BUSINESS WIRE)--T-Mobile US, Inc. (NASDAQ: TMUS) today announced that following an investment grade issuer rating from S&P Global Ratings (S&P) – the third it has received from credit rating agencies – the company now has its first-ever full investment grade rating. S&P has assigned the Company a BBB- with positive outlook. This follows the company securing a Baa3 rating with a stable outlook from Moody’s and a BBB- rating with a positive outlook from Fitch.This full investment grade rating comes as a result of T-Mobile’s successful operational and financial performance, which is consistently demonstrated through strong subscriber growth and the company’s ability to translate that into increasing free cash flow.“Achieving a full investment grade rating is an important milestone for T-Mobile that reflects the leading credit rating agencies’ positive outlook on our Un-carrier leadership strategy that is rooted in an unwavering focus on putting customers first,” said Peter Osvaldik, T-Mobile chief financial officer. “This ‘clean sweep’ in upgrades provides T-Mobile with the ability to unlock full access to the deep investment grade debt markets, which will further fuel our growth and momentum toward our mission of being the very best at connecting customers to their world.”About T-Mobile US, Inc.T-Mobile U.S. Inc. (NASDAQ: TMUS) is America’s supercharged Un-carrier, delivering an advanced 4G LTE and transformative nationwide 5G network that will offer reliable connectivity for all. T-Mobile’s customers benefit from its unmatched combination of value and quality, unwavering obsession with offering them the best possible service experience and undisputable drive for disruption that creates competition and innovation in wireless and beyond. Based in Bellevue, Wash., T-Mobile provides services through its subsidiaries and operates its flagship brands, T-Mobile and Metro by T-Mobile. For more information please visit: https://www.t-mobile.com.Forward-Looking StatementsThis communication includes forward-looking statements within the meaning of the Private Securities Litigation Reform Act of 1995. All statements other than statements of historical fact are forward-looking statements. These forward-looking statements are generally identified by the words “anticipate,” “believe,” “estimate,” “expect,” “intend,” “may,” “could” or similar expressions. Forward-looking statements are based on current expectations and assumptions, which are subject to risks and uncertainties that may cause actual results to differ materially from the forward-looking statements. These risks and uncertainties include those related to the Company’s operational and financial performance and the Company’s ability to access investment grade debt markets. Given these risks and uncertainties, readers are cautioned not to place undue reliance on such forward-looking statements. We undertake no obligation to revise or publicly release the results of any revision to these forward-looking statements, except as required by law."
