Topic,Link,Title,Article
Moody's Rating,https://www.businesswire.com/news/home/20220804006072/en/T-Mobile-Secures-First-Ever-Full-Investment-Grade-Rating,T-Mobile Secures First-Ever Full Investment Grade Rating,"BELLEVUE, Wash.--(BUSINESS WIRE)--T-Mobile US, Inc. (NASDAQ: TMUS) today announced that following an investment grade issuer rating from S&P Global Ratings (S&P) – the third it has received from credit rating agencies – the company now has its first-ever full investment grade rating. S&P has assigned the Company a BBB- with positive outlook. This follows the company securing a Baa3 rating with a stable outlook from Moody’s and a BBB- rating with a positive outlook from Fitch.This full investment grade rating comes as a result of T-Mobile’s successful operational and financial performance, which is consistently demonstrated through strong subscriber growth and the company’s ability to translate that into increasing free cash flow.“Achieving a full investment grade rating is an important milestone for T-Mobile that reflects the leading credit rating agencies’ positive outlook on our Un-carrier leadership strategy that is rooted in an unwavering focus on putting customers first,” said Peter Osvaldik, T-Mobile chief financial officer. “This ‘clean sweep’ in upgrades provides T-Mobile with the ability to unlock full access to the deep investment grade debt markets, which will further fuel our growth and momentum toward our mission of being the very best at connecting customers to their world.”About T-Mobile US, Inc.T-Mobile U.S. Inc. (NASDAQ: TMUS) is America’s supercharged Un-carrier, delivering an advanced 4G LTE and transformative nationwide 5G network that will offer reliable connectivity for all. T-Mobile’s customers benefit from its unmatched combination of value and quality, unwavering obsession with offering them the best possible service experience and undisputable drive for disruption that creates competition and innovation in wireless and beyond. Based in Bellevue, Wash., T-Mobile provides services through its subsidiaries and operates its flagship brands, T-Mobile and Metro by T-Mobile. For more information please visit: https://www.t-mobile.com.Forward-Looking StatementsThis communication includes forward-looking statements within the meaning of the Private Securities Litigation Reform Act of 1995. All statements other than statements of historical fact are forward-looking statements. These forward-looking statements are generally identified by the words “anticipate,” “believe,” “estimate,” “expect,” “intend,” “may,” “could” or similar expressions. Forward-looking statements are based on current expectations and assumptions, which are subject to risks and uncertainties that may cause actual results to differ materially from the forward-looking statements. These risks and uncertainties include those related to the Company’s operational and financial performance and the Company’s ability to access investment grade debt markets. Given these risks and uncertainties, readers are cautioned not to place undue reliance on such forward-looking statements. We undertake no obligation to revise or publicly release the results of any revision to these forward-looking statements, except as required by law."
Moody's Rating,https://www.prnewswire.co.uk/news-releases/aker-asa-assigned-investment-grade-rating-850305727.html,Aker ASA: Assigned Investment Grade Rating,"FORNEBU, Norway, Aug. 17, 2022 /PRNewswire/ -- Scope Ratings has assigned an investment grade rating of BBB-/Stable to Aker ASA. Scope has further assigned a first-time rating of BBB- to Akers senior unsecured debt and an S-2 short-term rating.In the rating report, Scope notes that the rating is driven by Akers low leverage and its controlled cost coverage, balancing cash inflow and outflows, in addition to that the liquidity of Akers assets further benefits the rating.We see this rating as a recognition of Akers resilient financial performance and as a means of strengthening our position in the credit markets going forward.The rating report from Scope Ratings is available at www.scoperatings.com.For more information, please contact:Investors:Joachim Bjørni, Head of Investor Relations, Aker ASATel: +47 924 22 106E-mail: joachim.bjorni@akerasa.comMedia:Atle Kigen, Head of Media Relations and Public Affairs, Aker ASATel: +47 907 84 878E-mail: atle.kigen@akerasa.comThis information is considered to be inside information pursuant to the EU Market Abuse Regulation and is subject to the disclosure requirements pursuant to Section 5-12 the Norwegian Securities Trading Act. This stock exchange announcement was published by Laila Hop, Paralegal, Aker ASA, on August 17, 2022, at 06:58 CEST.This information was brought to you by Cision http://news.cision.comhttps://news.cision.com/aker-asa/r/aker-asa--assigned-investment-grade-rating,c3615040SOURCE Aker ASA"
Moody's Rating,https://seekingalpha.com/article/4526282-strong-return-on-main-street-investment-grade-bond,Fixed 6.5% Return On Main Street's Investment Grade Bond (NYSE:MAIN),"ChunumunuQuick Introduction To Business Development Companies (""BDCs"")Business development companies (""BDCs"") invest shareholder capital in privately owned, small- and medium-sized U.S. companies. BDCs aim to generate income and capital gains when the companies they invest in are sold, much like venture capital or private equity funds. Anyone can invest in BDCs, as they are public companies traded on major stock exchanges.BDC BuzzInvestment Grade BDC Bonds/NotesMany BDCs have investment grade (""IG"") bonds/notes for lower-risk investors that do not mind lower yields/returns. Thanks to the recent declines in fixed income, the traditional bond market is now offering some excellent values, especially in the BDC sector, and I will discuss over the coming weeks. However, many of these bonds are now rebounding and I have started making purchases of shorter and mid duration maturities.Traditional bonds do not trade on stock exchanges but are available through your brokerage using CUSIP numbers with a face/maturity value of $1,000. These bonds pay interest semi-annually with a pro-rated interest payment on the purchase date. Brokerages express the trading prices as a percentage of the face value. As shown below, MAINs 2026 bond is currently priced at $87.79, which implies a current value of $877.90 for each bond. For more information on examples of how to trade bonds using CUSIPs and limit orders, please see the following link.Most BDC bonds have credit ratings from Moodys and/or S&P and so far, no BDC has ever defaulted for the reasons discussed last week in:As shown below, BDCs are highly regulated with plenty of protections for investors in the common stock and debt obligations, such as the amount of leverage (asset coverage ratios discussed later), asset diversification, and having a portfolio that can ""generate sufficient cash flows to pay interest as well as dividends to equity investors junior to debt holders"":ARCC Presentation MAINMAIN Street Capitals Investment Grade BondsMain Street Capital (NYSE:MAIN) has three investment grade bonds (CUSIPs: 56035LAE4, 56035LAD6, 56035LAC8) that are investment grade rated by both S&P and Fitch at BBB- with a stable outlook reflecting:Main Streets portfolio focus on senior debt investments, strong portfolio diversification, solid track record in credit and equity investments, above-average asset coverage cushion, consistent operating performance, experienced management team and strong funding flexibility with demonstrated access to the public debt and equity markets.""Source: Main Street Announces Investment Grade Rating (July 14, 2022)MAIN PresentationAs discussed in the previously linked article, the ""Asset Coverage Ratio"" is a financial metric that measures how well a company can repay its debts by selling or liquidating its assets. The higher the asset coverage ratio, the more times a company can cover its debt. Therefore, a company with a high asset coverage ratio is considered less risky than a company with a low asset coverage ratio. BDCs are required to maintain minimum asset coverage of 150% providing strong protection to bondholders, which is one of the reasons that no publicly traded BDC has ever filed for bankruptcy nor defaulted on bond holders in the history of the sector.As of March 31, 2022, MAINs asset coverage ratio was 227% as shown below:BDC BuzzThe ""Interest Expense Coverage"" ratio is used to see how well a company can pay the interest on outstanding debt. Also called the times-interest-earned ratio, this ratio is used by creditors and prospective lenders to assess the risk of lending capital to a firm. A higher coverage ratio is better, although the ideal ratio may vary by industry. When a companys interest coverage ratio is only 1.5 times or lower, its ability to meet interest expenses may be questionable.MAINs interest expense coverage ratio has historically averaged around 4.0 times, as shown below:BDC BuzzInterest rate sensitivity refers to the change in earnings that may result from changes in interest rates. As of March 31, 2022, around 73% of MAINs portfolio debt investments bore interest at variable rates, 93% of which were subject to contractual minimum interest rates and only 19% of borrowings were also at variable rates. Theres a good chance that many BDCs will be increasing dividends over the coming quarters, especially as the Fed will likely increase rates by another 75 points today, driving a significant improvement in this analysis for most BDCsOne additional item that I wanted to touch on is the impact of rising interest rates. With the additional $500 million in low-cost fixed rate notes that we issued in 2021, as of the end of the first quarter, 81% of Main Streets outstanding debt obligations maintain fixed interest rates. This mitigates our exposure to higher interest expense during a rising interest rate environment. On the other hand, as of the end of the first quarter, approximately 73% of our debt investments bear interest at floating rates with the majority subject to contractual interest rate floors and with a weighted average fall of approximately 105 basis points. As a result, future increases in interest rates will result in increases to interest income, which will exceed the increases to interest expense.""Source: MAIN Investor CallBDC BuzzCurrent Yields For Common Stock and BondsIn May 2022, MAIN reaffirmed its regular monthly dividends of $0.215 per share for Q3 2022, plus a supplemental cash dividend of $0.075 per share.FidelityMAIN is considered a safer BDC, which is why it has a lower-than-average dividend yield currently around 6.5% compared to an average of around 7.3% over the last 5 years. However, MAINs dividend yield has been trending lower, especially after excluding the March 2020 market disruption.BDC BuzzMAINs 2026 bond is trading at a significant discount, driving a yield-to-maturity of 6.5% which is above the current dividend yield from its common stock. Also, over the next four years, this bond will slowly appreciate toward par of $1,000 and capital gains will account for a good portion of the yield-to-maturity driving a lower tax liability.FINRAThe following chart and table are from the BDC Google Sheets showing MAINs bonds. As mentioned earlier, I have started purchasing shorter and mid duration bonds with relatively higher yields (for similar durations).Over the coming weeks, I will cover many other BDCs listed below, including their asset and interest expense coverage ratios:BDC BuzzConclusion - Risk-Adjusted ReturnsGiven the uncertainty of upcoming returns from equity/stock positions, I would suggest that investors take this opportunity to lock in a 6.5% annualized return, at far lower risk, over the next four years. MAINs stock price is likely overbought at these levels and its relative strength index (""RSI"") is currently 70, which is typically a firm indicator:FidelityThe key risk to the bondholder is a default by MAIN, which is extremely remote given the companys history/performance:MAIN is one of the best-of-breed BDCs with a long track record of returns through previous market cyclesAsset coverage of debt is 227% and by regulation must be at least 150%Interest expense coverage has averaged around 4.0 times, which is much higher than most companiesMAINs bonds are rated investment grade by both S&P and FitchNo publicly traded BDC has ever filed for bankruptcy and impaired debt holders in the history of the sectorA 6.5% locked-in return for the next four years is attractive in an environment of high market volatility and uncertainty of returnsUpcoming BDC Reporting DatesBDCs have begun reporting Q2 2022 results and Im expecting improved results relative to Q1 2022, including higher dividend coverage and maintained credit quality but slightly lower NAVs (similar to Q1 2022) simply due to widening credit spreads (not credit quality related). Theres a good chance that many BDCs will be increasing dividends, especially as the Fed will likely increase rates by another 75 points today, driving a significant improvement in the Interest Rate Sensitivity analysis for most BDCs (similar to the previous quarter). This means that projected earnings for Q3 and Q4 will probably need to be increased. Also, most BDCs have been positioning for a recession for a while now and COVID provided a portfolio stress test which most BDCs took advantage of the market rebound to rotate into more secured positions with higher cash flow coverage preparing for higher interest rates and/or an economic slowdown/recession.Over the coming weeks, I will cover many other BDCs listed below, including their asset and interest expense coverage ratios:"
Moody's Rating,https://www.bloomberg.com/news/articles/2022-08-18/country-garden-s-first-half-core-profit-plunges-70-amid-turmoil,Innovator S&P Investment Grade Preferred ETF (BATS:EPRF) Shares Sold by Advisor Group Holdings Inc.,"Advisor Group Holdings Inc. trimmed its position in Innovator S&P Investment Grade Preferred ETF (BATS:EPRF – Get Rating) by 40.3% in the first quarter, according to its most recent disclosure with the Securities and Exchange Commission (SEC). The firm owned 88,070 shares of the company’s stock after selling 59,369 shares during the period. Advisor Group Holdings Inc.’s holdings in Innovator S&P Investment Grade Preferred ETF were worth $1,915,000 as of its most recent SEC filing.Other institutional investors have also recently added to or reduced their stakes in the company. Executive Wealth Management LLC acquired a new stake in shares of Innovator S&P Investment Grade Preferred ETF during the 1st quarter valued at $275,000. RPg Family Wealth Advisory LLC lifted its position in shares of Innovator S&P Investment Grade Preferred ETF by 2.3% during the 4th quarter. RPg Family Wealth Advisory LLC now owns 103,687 shares of the company’s stock valued at $2,488,000 after acquiring an additional 2,342 shares during the last quarter. Madrona Financial Services LLC acquired a new stake in shares of Innovator S&P Investment Grade Preferred ETF during the 4th quarter valued at $492,000. Core Wealth Advisors Inc. acquired a new stake in shares of Innovator S&P Investment Grade Preferred ETF during the 4th quarter valued at $117,000. Finally, Envestnet Asset Management Inc. lifted its position in shares of Innovator S&P Investment Grade Preferred ETF by 8.4% during the 1st quarter. Envestnet Asset Management Inc. now owns 100,866 shares of the company’s stock valued at $2,194,000 after acquiring an additional 7,846 shares during the last quarter.Get Innovator S&P Investment Grade Preferred ETF alerts:Innovator S&P Investment Grade Preferred ETF Trading Down 0.1 %Shares of BATS:EPRF opened at $21.01 on Wednesday. Innovator S&P Investment Grade Preferred ETF has a one year low of $22.49 and a one year high of $25.00. The stock has a fifty day moving average of $20.12 and a 200-day moving average of $20.70.Further ReadingReceive News & Ratings for Innovator S&P Investment Grade Preferred ETF Daily - Enter your email address below to receive a concise daily summary of the latest news and analysts ratings for Innovator S&P Investment Grade Preferred ETF and related companies with MarketBeat.coms FREE daily email newsletter."
Moody's Rating,https://www.defenseworld.net/2022/08/17/innovator-sp-investment-grade-preferred-etf-batseprf-shares-sold-by-advisor-group-holdings-inc.html,FS KKR Vs. Main Street: Better Investment Grade High Yield Buy (NYSE:FSK),"adaaskBoth FS KKR (NYSE:FSK) and Main Street Capital (NYSE:MAIN) have investment grade (BBB- Stable from S&P) credit ratings, vaulting them into the upper echelon of quality Business Development Companies (i.e., BDCs) (BIZD). Both also happen to offer mouthwatering dividend yields, with FSK boasting a mouthwatering 12.6% dividend yield and MAIN offering a juicy 6.2% dividend yield.In this article, we will compare them side by side and offer our take on which one is a better buy.Balance SheetAs was already stated, both FSK and MAIN have the same investment grade credit rating and outlook (FSK has a Baa3 rating with a Stable outlook from Moodys and MAIN has a BBB- rating with a Stable outlook from S&P), which puts them on similar footing in terms of perceived risk and access to capital.FSK has $2.6 billion in total liquidity (~17% of its enterprise value) with a leverage ratio of 1.12x. 47.4% of FSKs total outstanding debt is floating rate as of the end of Q1.MAIN, meanwhile, has $535 million in total liquidity (~11.2% of its enterprise value) and a leverage ratio of under 1x. 18.5% of its total outstanding debt is floating rate as of the end of Q1.While both appear to be in solid shape and FSKs liquidity position seems stronger, MAIN seems to have the stronger balance sheet overall with lower leverage and much less floating interest rate exposure.Investment PortfolioFSKs portfolio consists of 69% senior secured debt and 87% of its debt investments are floating rate, meaning that nearly 80% of the total investment portfolio benefits from rising interest rates. Furthermore, FSKs portfolio is generally overweight more defensive sectors, with its top five sectors being software, capital goods, healthcare, commercial and professional services, and real estate. Non-accruals were very low as of 3/31/22 at just 1.5% at fair value.MAINs portfolio consists of 69% senior secured debt and 73% of its debt investments are floating rate, meaning that 58.6% of the total investment portfolio benefits from rising interest rates. Furthermore, MAINs portfolio is generally overweight more defensive sectors, with its top five sectors being commercial and professional services, machinery, capital goods, software, and distributors. Non-accruals were very low as of 3/31/22 at just 0.6% at fair value.Both portfolios have their strengths. FSKs is larger and therefore better diversified, has significantly more exposure to debt investments, and is better positioned to see income increase from rising interest rates. Meanwhile, MAIN has a lower non-accrual rate (though it is not quite as good as it first appears given that it has less exposure to debt, which is the only investment class that can go on non-accrual status) and potentially better growth potential given its greater exposure to equity.It is also worth noting that MAIN has outperformed FSK over the years:Data by YChartsWhile it is extremely close, we are going to give a slight edge to FSK here, though we also recognize that MAIN has a tremendous track record. However, given that we have a separate section for that, we will just stick with objective evaluation of the numbers here. Given that FSK has much greater exposure to floating rate interest rates, is better diversified, and has greater exposure to debt relative than equity, we favor FSKs portfolio in the current climate.DividendThis section is not entirely relevant to the comparison as FSK implements a varying dividend policy by paying out nearly all of its earnings each quarter, whereas MAIN pursues a progressive monthly dividend policy where it supports its base dividend and tries to grow it over time. As a result, we are simply going to say here that we think that FSKs total recent dividend payout of 12.6% more than doubles MAINs 6.2% payout and therefore believe that FSKs margin of safety for paying out a higher yield than MAIN does over the course of a fiscal year is sufficiently large to give it a more attractive overall dividend.Track RecordAs we already discussed in a previous section, MAINs track record is convincingly superior to FSKs. However, there are some caveats to that superior performance. For example, this outperformance was largely facilitated by an expanding P/B ratio for MAIN and a shrinking P/B ratio for FSK as well as a major equity bull market, which provided outsized benefits to MAIN:Data by YChartsAdditionally, FSK has gone through several changes over the years which are expected to improve its performance moving forward, including a merger about 13 months ago which has improved the BDCs leverage ratio, unlocked synergies and efficiencies, and prompted management to institute a buyback program.Nevertheless, MAIN still wins the track record comparison without a doubt.ValuationFSK wins the valuation comparison with flying colors. Not only is its dividend yield more than twice that of MAINs, but MAIN currently trades at a whopping 58.25% premium to NAV while FSK trades at the largest discount of investment grade BDCs with a 24.95% discount to NAV. When you consider that FSKs portfolio is arguably as conservatively positioned - if not more so than MAINs - and also benefits from parental support from the credit arm of one of the top alternative asset managers in the world (KKR (KKR)), this valuation gap seems unreasonably large.Investor TakeawayUnsurprisingly, this comes down to a competition between track record and value. MAIN has a stronger balance sheet and a vastly superior track record. Meanwhile, its portfolio is more aggressively positioned than FSKs is. As we head into a recessionary environment, it becomes increasingly important to account for the support FSK receives from KKR, its greater diversification, and its more defensive portfolio positioning. Additionally, its recent changes designed to improve efficiencies and unlock shareholder value via buybacks and aggressive dividend payouts along with its deep discount to NAV make it a very compelling buy here. In fact, we rate it a Strong Buy and it is one of our top BDC picks at High Yield Investor. Meanwhile, MAINs heavier equity exposure and massive premium to NAV force us to rate it a Hold, even though we certainly have regard for its impressive track record."
