Topic,Link,Title,Article
Moody's Rating,https://www.bloomberg.com/news/articles/2022-01-25/tesla-inches-toward-blue-chip-status-with-moody-s-credit-upgrade,Netflix likely to upgrade from junk status to investment-grade status,"Netflix Inc. is edging closer to investment-grade status, according to Bloomberg Intelligence, amid a wave of credit upgrades in the past year.The streaming video company may see an upgrade from junk status by Moody’s Investors Service, which would be the second grader to take the company to investment grade, according to credit analysts Stephen Flynn and Suborna Panja. The pandemic has boosted Netflix’s profit as homebound people have spent more time watching streaming video services.A Moody’s upgrade would make much of Netflix’s $16 billion equivalent of bonds eligible for Bloomberg’s high-grade indexes, after S&P Global Ratings upgraded the company in October. Netflix could also gain high-grade status if Fitch Ratings, which currently does not grade the company, begins coverage with a blue-chip rating. Representatives for Netflix didn’t immediately return a request for comment.Companies that leave junk status and become investment grade, known as rising stars, can often get financing from a deeper pool of borrowers at lower rates. There could be another $169 billion wave of such shifts by 2023, Bloomberg Intelligence wrote in December, as companies show more signs of recovery from the pandemic.Companies have already been getting upgraded out of high-yield status -- Dell Technologies Inc., for example, was lifted to investment-grade status by two firms in September. These rising stars come after the pandemic clobbered the global economy in 2020, triggering a wave of downgrades to junk that year.Rising stars often sell high-grade bonds soon after they are upgraded, and tend to perform better than the broader market, according to Yuri Seliger, Bank of America Corp. credit strategist.“Rising stars should be bought as soon as possible,"" he wrote in December.Netflix’s credit profile has improved in recent years. The company borrowed billions of dollars to fund the production of TV shows and movies like “Stranger Things"" and “Don’t Look Up"" as well as licenses for existing programming for its popular streaming service. As its customer base has grown, its needs for outside cash has dwindled. The company has said it won’t need to borrow much money in the future.In 2022, Netflix expects to generate positive free cash flow after being about breakeven in 2021, Flynn and Panja wrote. S&P ranks the global streaming services leader BBB, two steps above high yield. Moody’s has a Ba1 rating, just one step shy of investment grade, with a positive outlook, after upgrading the company in April.The company at the end of the third quarter had debt equal to about 1.1 times its earnings before interest, taxes, depreciation and amortization, according to Bloomberg Intelligence, a level typically associated with investment-grade ratings. In 2019, that ratio was closer to 3.2 times.It also has “ample liquidity,"" Flynn wrote in a separate note, with $7.5 billion in cash and an undrawn revolving credit line of $1 billion. Netflix’s ratio of free cash flow-to-debt, meanwhile, could rebound over the next two years and mimic levels of high-grade media companies such as ViacomCBS, he wrote.Netflix isn’t likely to issue bonds until the potential $400 million refinancing of its 5.75% notes due in March 2024, Flynn wrote, assuming no major acquisitions. The company’s 5.875% notes due 2028 were trading around 120 cents on the dollar on Monday, according to Trace bond trading data. Netflix is expected to next report quarterly earnings on January 20.“Netflix’s impressive credit metrics are improving, helped by a massive liquidity war chest,"" Flynn and Panja wrote. “The metrics compare favorably with high-grade-rated media peers, to say nothing about its vastly superior growth rate.""This story has been published from a wire agency feed without modifications to the text. Only the headline has been changed."
Moody's Rating,https://www.businesswire.com/news/home/20220418005090/en/Hercules-Receives-a-BBB-Reaffirmed-Investment-Grade-Corporate-Rating-From-DBRS-Inc.,"GE’s Credit Rating Was Just Updated By Fitch. There’s No Downgrade, Despite Downbeat News.","Fitch Ratings released an update on General Electric Tuesday, saying it will keep the conglomerate at BBB+, an investment-grade credit rating.The decision leaves the debt in the third notch above speculative grade, a rating that matches those by Moody’s Investors Service and Standard & Poor’s, the two other major credit-rating companies. The fact that General Electric (ticker: GE) avoided a downgrade may surprise some investors, given the flurry of negative news surrounding the stock in recent months."
Moody's Rating,https://finance.yahoo.com/news/epr-properties-receives-investment-grade-201500929.html,S&P raises Portugal credit rating to investment-grade,"S&P Global Ratings hiked Portugals credit rating one notch to BBB-, returning it to ""investment-grade"" status. Large institutional investors like pension funds may be required to abstain from buying bonds ranked below investment-grade. The ratings company boosted the countrys growth forecast to an annual 2% between 2017 and 2020. The rating change also reflects ""solid progress [Portugal] has made in reducing its budget deficit."""
Moody's Rating,https://www.globenewswire.com/news-release/2021/06/03/2240908/0/en/Futu-Announces-Investment-Grade-Rating-from-S-P-Global-Ratings.html,DoubleLine reconsiders its aversion to investment grade corporates,"When stocks go down, junk bonds usually hit the skids too.And this year is no different with the S&P 500 index down 17.7% through May 20 and the Bloomberg US Corporate High Yield index down 11%.But the odd thing this year is that investment grade corporate bonds are faring worse than their riskier high yield counterparts, with the Bloomberg US Corporate index down 13%. And that has made them more attractive to fixed income investors, including those who’ve shunned them in the recent past, including Jeffrey Gundlach’s DoubleLine Capital.Investment grade corporate bonds have stumbled because interest rate risk rather than credit risk has been driving the current moves. Investors have been more worried about rate hikes and the previously puny yields of investment grade corporates than they have about their credit risk.‘It’s all been about rates,’ said Robert Cohen, director of global developed credit at DoubleLine, noting that floating rate loans along with their junk bond cousins have also held up better than investment grade corporates.If the Federal Reserve does engineer a recession by hiking rates, that could be worse for both high yield bonds and bank loans, which need a robust economy to avoid default.Fading the trade‘Investment grade credit requires less growth to perform than high yield,’ said Cohen, surmising that investment grade could be poised to outperform in a weakening economy.‘We’ve moved to neutral on bank loans and CLOs [securitizations of bank loans], while we were overweight last year. We didn’t see growth concerns on the horizon, and we saw rate concerns. . . .[but] now our outlook is to continue to fade the [floating rate/bank loan] trade,’ he added.DoubleLine had been bearish on investment grade corporate coming into the year. Founder and CEO Gundlach has spoken frequently about tight spreads and paltry yields on these bonds. The firm’s stance has now softened. ‘As we started to go through this period of re-setting rates in the Treasury market, [we’ve also] re-set the relationship in investment grade. Now yields are higher,’ Cohen said.Despite fading the bank loan trade, Cohen favors going somewhat down the credit scale within the investment grade universe. He explained that the 4-year bonds of large banks such as Citigroup and JP Morgan are fetching close to 4%, while one would have to purchase a 13-year Microsoft bond – with much more duration risk - to achieve a similar yield.If a little credit risk is better than interest rate risk in the investment grade universe, the opposite is true in high yield.There, Cohen said, it is better to ‘hug the BB sector,’ which is the highest junk rating. There’s less of a need to go down the credit scale to generate reasonable yield in high yield currently. It’s ‘way too early to talk about CCCs, which are idiosyncratic and live on their own credit risk. If growth slows, CCCs will be at most risk.’Traditionally in the high yield universe, defaults have been over 4% annually, while recoveries have adjusted that to a loss rate somewhat over 2%. But those are average annual numbers, and from year to year the numbers can vary considerably. Cohen said the assumptions for the future of defaults, recoveries, and ultimate loss rates are the subject of great debate at DoubleLine currently.The most recent portfolio the firm has published for its DoubleLine Core Fixed Income fund (DBLFX) shows 17.1% exposure to investment grade corporates and 4.3% exposure to high yield corporates as of the end of April.A dissenting viewNot everyone is turning sanguine about investment grade, however. Carl Kaufman, manager of the Osterweis Strategic Income fund (OSTIX), a high yield strategy, thinks investment grade bonds could come under further pressure from rate hikes.In that view, however, he agrees with Cohen from DoubleLine that rates have been affecting investment grade corporates adversely.‘We know we have at least two 50 basis point [hikes] coming in a few months. The market always seems to act surprised when it happens, so I think you might get a few legs down in the investment grade universe,’ he said.Within the high yield universe, Kaufman took a different stance to Cohen. There he’s avoiding BB-rated bonds because he ‘[doesn’t] want rate sensitivity.’ Lower rated bonds tend to pay higher yields, and that can lower their duration risk.But neither is Kaufman buying CCC-rated bonds because ‘we’re trying to avoid companies with a lot of leverage.’Kaufman tends to like companies that make things or are efficient users of capital, and that latter criterion applies to some wholesale lenders and mortgage companies, in his opinion.He added that he was nonplussed with the Fed’s reaction to recent spikes in the consumer price index.‘[This is] the worst inflation in 40 years, but there’s no special meeting, no balance sheet reduction [from the Fed]. Its sense of urgency underwhelms us,’ he said."
Moody's Rating,https://www.ekathimerini.com/economy/1180174/dbrs-morningstar-brings-greece-one-step-from-investment-grade/,South Africa looks to structural reforms as it loses its last investment-grade credit rating,"PRETORIA, SOUTH AFRICA - MARCH 16: Finance minister, Tito Mboweni briefs the media on the details of government interventions in various sectors of the departmental portfolios on COVID-19 at DIRCO Media Centre. Phill Magakoe/Gallo Images via Getty ImagesSouth Africa has lost its last remaining major investment-grade sovereign credit rating, as existing economic weakness is compounded by the potential impact of the global coronavirus pandemic. South Africa has no investment-grade sovereign credit rating from any of the major ratings agencies for the first time since its return to global markets in 1994. Moodys announced on Friday that it had cut the countrys last investment-grade rating to ""junk,"" sending the Rand to an all-time low of below 18 to the dollar. Standard & Poors and Fitch both downgraded Africas most industrialized economy to sub-investment grade in 2017. In its release, Moodys cited structurally weak growth, limited capacity to stimulate the economy and an ""inexorable rise"" in government debt over the medium term as key reasons for the downgrade and maintenance of its ""negative"" outlook.The situation has been exacerbated by the expected economic impact of the coronavirus pandemic. Confirmed cases in South Africa have now exceeded 1,300, though the government is hoping that drastic early lockdown measures will prevent the exponential spread seen in Europe and the U.S. ""Unreliable electricity supply, persistent weak business confidence and investment as well as long-standing structural labour market rigidities continue to constrain South Africas economic growth,"" Moodys said, adding that these factors mean South Africa is entering a period of much lower global growth in an ""economically vulnerable position."" Debt-to-GDP (gross domestic product) increased by 10 percentage points from 2014-18 and Moodys expects this to rise by a further 22 percentage points between 2019 and 2023, with the deficit widening in 2020 to around 8.5% of GDP. Fiscal strains from interest payments and support to state-owned enterprises will continue, the agency predicted. The government debt burden is expected to rise from 69% of GDP in 2019 to 91% by the end of 2023.It is up to South Africa""South Africas credit rating has deteriorated because of very low (and currently negative) economic growth, large fiscal deficits and sharply rising public debt, loss-making state-owned entities, and deep contestation of proposed social and economic policy reforms,"" explained Jeff Gable, head of research at South Africas Absa Bank. In a statement Monday, Gable suggested that whether South Africa will return to investment grade or slide further away relies on the country demonstrating ""significant improvement"" in its economic reforms. ""It is hard to argue that South Africa hasnt witnessed a steep deterioration in fundamentals, in part by our own inability to act over the last decade and in part due to the new risks due to the global virus,"" Gable said. ""And so it is the agencies duty to reflect that in their ratings. Similarly it is clear that it is up to South Africa, and not the credit rating agencies, as to which direction that country would like to take going forward.""Bold structural reformsOn Sunday, Finance Minister Tito Mboweni and South African Reserve Bank (SARB) Governor Lesetja Kganyago held a media conference call, in which Mboweni said that he and President Cyril Ramaphosa had vowed to move ""more boldly"" on their structural reforms program. Mboweni announced the creation of a unit within the finance ministry called ""Vulindlela"" – which means ""lead the way"" in isiZulu – that ""will become the front soldiers of structural reforms in the South African economy,"" according to a research note Monday from NKC African Economics.President Cyril Ramaphosa during a pre-World Economic Forum breakfast briefing on January 18, 2018 in Johannesburg, South Africa. Moeletsi Mabe| Sunday Times | Gallo Images | Getty Images"
